PMCID	AccessionNb	Section	SubType	Figure	Categories	PreCitation	Citation	PostCitation	Background	Creation	Use
PMC3943257	JQ690762	Introduction	ENA	False	Use	Viral surveillance programs have isolated more than 50 CAV samples from different provinces in China during 2009–2012, and the epidemiological analysis suggested that CAVs were prevalent in China. 	We also analyzed the characteristic of one strain (GD-1-12), which was isolated in Southern China in 2012; the GD-1-12 isolate's genome at position 183 has a 21 nt deletion (TCCGTACAGGGGGGTACGTCA) in comparison with the genome (accession no. JQ690762) of the CAV isolate from human fecal samples. 	It is unclear if the 21 nt deletion is related to host specificity or pathogenicity [5]. In 2010, the CAV genome has been detected in breeder and commercial chicken flocks in South Korea [6]. 	3.8106770290641807e-06	2.5380786648570936e-06	0.9999936512443061
PMC3374772	JQ281259	Results	ENA	False	Use	Evaluation of fragments for which there was an available corresponding S gene sequence also identified a difference in mutational patterns at the subgenotype level: B2 viruses compared to B4 for both G1896A (20%, n = 1/5 vs 40.2%, n = 53/132) and A1762T/G1764A (40%, n = 2/5 vs 19.7%, n = 26/132). 	We also identified a 21 bp deletion in the basal core promoter region of one sequence from a 55 year-old multi-transfused patient in Khanh Hoa (JQ281259). 	Genetic Variability at the IL28B Locus HBsAg positive individuals (n = 368) from the five centres were genotyped for the IL28B SNP rs12979860 and the C allele frequency was found to be 93%. 	2.6370282489738446e-05	4.211992897163092e-07	0.9999732085182205
PMC6273073	KU350741	Results	ENA	False	Creation	Accordingly, the isolate was identified as Buttiexella sp. 	M44 and the associated 16S rRNA sequence was deposited in Genbank with accession number KU350741. 	The glycolipid BSs produced by Buttiauxella sp. M44 exhibited a different inhibitory effect on the test microorganisms (Table 1). 	3.0885191477278037e-09	0.9999994173576692	5.795538117725033e-07
PMC4338595	3NGB	Figure	PDBe	True	Use	Segments unresolved in the crystal structure (V2, V4, and FPPR) are shown as dashed lines. 	As a reference, the binding surfaces of each bNAb on gp120 are shown in green (PDB: 3NGB, 2NY7) 21, 22. 	Although b12 binds a more open conformation of the trimer 9, 17, 18, for the sake of comparison all data are illustrated on the closed, pre-fusion structure. Butterfly plots show the exchange profiles of SOSIP.664 trimers either unliganded or as complexes with (A) PG9 Fab, (B) PGT123 Fab, (C) 2G12 IgG. 	5.644377049045125e-28	2.1809208413912537e-16	0.9999999999999998
PMC3400600	rs6552828	Title	RefSNP	False	Use	A GWA study was recently conducted by Bouchard et al. [3] in sedentary Caucasians to study the association of 324,611 single-nucleotide polymorphisms (SNPs) and the trainability of one of the main phenotype traits indicative of human endurance performance, i.e. maximal oxygen uptake (VO2max). 	The strongest association with the training response of VO2max was found to acyl coenzyme A synthetase long-chain 1 (ACSL1) gene polymorphism (rs6552828). 	The ACSL1 gene is a candidate to explain individual variability in endurance performance, as well as in some health-related phenotypes, owing to its potential role in aerobic metabolism at the adypocite, cardiomyocite, liver and skeletal muscle fiber level [4], [5], [6], [7], [8], [9]. The findings of GWA studies should be further explored in genetic association studies focused on those SNPs showing the highest level of association [2]. 	4.973609113164316e-05	9.092297166613747e-13	0.9999502639079593
PMC3509713	EDO31964	Discussion	ENA	False	Background	A genetic exchange from viruses to their metazoan hosts was demonstrated among short proteins [34]. 	However, for a number of sequences the apparent relatedness to metagenomic sequences is clearly spurious (e.g., EDO31964.1, 130 amino acids). 	nan	0.501751598399039	1.0838321037958314e-05	0.49823756327992297
PMC5428514	GSE65194	Introduction	GEO	False	Use	Both down- and up-regulation of alpha- and beta- subunits were shown in solid tumors of different origin 14– 19. 	In the present study, we analyzed public breast cancer expression profiles made using Affymetrix Human Genome U133 Plus 2.0 Array (NCBI GEO database 20, accession GSE65194) for the expression of alpha subunits of NKA. 	We found abnormalities in ATP1A1 (coding α1-subunit) and ATP1A2 (coding α2-subunit) expression ( Table 1) in breast cancer samples relative to their expression in normal breast tissue. ATP1A1 was overexpressed approximately 1.5 times in all groups of breast cancer samples (p<0.05). Coincidently, ATP1A2 expression decreased by more than 2 times (p<0.05). 	6.426584027617608e-10	1.354190655316528e-08	0.9999999858154351
PMC5519329	PF00096	Methods	Pfam	False	Use	We then assessed significance empirically by comparing the value of this statistic to other C2H2 ZF genes from the same species (where possible). 	To this end, for each species with a PRDM9 ortholog, we downloaded the nucleotide and protein sequences for all available RefSeq genes with a C2H2 ZF motif annotated in Conserved Domain Database (pfam id# PF00096). 	To simplify alignment generation, we only used tandem ZF arrays with four or more ZFs matching the 28 amino acid long C2H2 motif (X2-CXXC-X12-HXXXH-X5 where X is any amino acid). In all of our analyses, if a gene had multiple tandem ZF arrays that were spatially separated, only the first array of four or more adjacent ZFs was used for the following analysis (Supplementary file 3B). 	7.373535961849852e-07	4.545892076252295e-06	0.9999947167543275
PMC3310866	1TZI	Results	PDBe	True	Use	Predicted ranking of the CDR amino acids in the antibody-VEGF complex interfaces. 	Panel (a) to (e) shows the complex structure for 1BJ1, 2FJH, 2QR0, 1TZH, and 1TZI respectively. 	In each of the panels, the atoms of the antigen VEGF are shown in spheres; the VEGF atoms colored in magenta are core interface atoms and the VEGF atoms colored in cyan are rim interface atoms. The core-rim assignment follows the definition previously published [54]. 	1.4080996821410716e-22	3.616612637828542e-10	0.9999999996383386
PMC6208079	CJ005077	Acknowledgments	ENA	False	Creation	Representative sequences were submitted to the GenBank database under the accession numbers KY365435-KY365437. 	Voucher specimens are available in the collection of the Museum of Parasitology, Department of Parasitology and Parasitic Diseases, University of Agricultural Sciences and Veterinary Medicine Cluj-Napoca, Romania under accession numbers CJ005077, CJ005086. 	The dataset and reference materials are available from the corresponding author upon request. 	3.6309311242071874e-07	0.999842931111035	0.00015670579585253655
PMC3943257	JQ690762	Introduction	ENA	False	Use	The complete genome sequence of CAV variant was submitted to GenBank, under the accession number KC414026. 	The CAV variant genome was 2,295 nt long, very close to the genome size (2,316 nt) of the CAV isolated from human fecal samples (accession no. JQ690762). 	Comparative analyses showed that CAV variant shared the greatest sequence identity (98.1%) with the CAV isolate from Japan (AH9410) and the least identity (38%) with the GyV3 isolate from the USA. The VP1, VP2, and VP3 genes of the CAV variant showed nucleotide variations of 1–63.1%, 0.5–51.9%, and 0.5–50.5%, respectively, among the 36 relevant sequences from GenBank. 	0.000582883686065862	0.00756483968034884	0.9918522766335853
PMC6249285	AGS83373	Methods	ENA	False	Use	Molecular cloning of Agp2-PAiRFP2 	The DNA sequence of Agp2-PAiRFP2 (NCBI GenBank ID AGS83373.1)25 was codon optimized (Supplementary Table 2)38. 	The gene was synthesized by GENEWIZ Inc. and cloned into a pET21b expression vector with C-terminal His-tag and transformed into E. coli BL21-DE3. The construct contains the following 24 substitutions: Lys69Arg, Arg83Lys, Gly120Asp, Ala123Thr, Met163Leu, Gln168Glu, Arg220Pro, Ser243Asn, Val244Phe, Gly269Asp, Ala276Val, Tyr280Cys, Glu294Ala, His303Phe, His333Arg, Ile336Leu, Asp349Arg, Met351Ile, Ala386Val, Gly409Asp, Leu419Ile, Thr469Ser, Ala487Thr, Glu494Gly (Supplementary Figs. 4, 12). 	6.051639841579823e-07	1.3496514184620748e-05	0.9999858983218312
PMC3361161	GSE34685	Results	GEO	False	Use	Twenty-two genes are enzymes with a variety of functions (44%), and these comprised the major part of the genes upregulated in the stbC mutant strain grown on solid agar. 	The detail results of the microarray assay in the present study can be accessed at GEO accession number GSE34685. 	nan	0.0002568343275752054	0.0011705777698055744	0.9985725879026192
PMC3125170	JN086998	Results	ENA	False	Use	Because we detected the HBoV-EPI form in only 1 sample, we re-extended and re-sequenced the complete HBoV3-E1 genome using the inverse PCR fragment as a starting point for genomic analysis. 	Every base of the complete HBoV3-E1 genome was sequenced at least 3 times (Genbank accession no. JN086998). 	The PCR product chromatograms were consistent with infection by a single HBoV lineage. However, mixed HBoV infection cannot be ruled out as population sequencing only allows detection of a minority of variants comprising >10% of the total sequences. 	2.1479573894035647e-08	4.101606416883136e-05	0.9999589624562574
PMC5853437	PRJNA248164	Results	BioProject	False	Use	BUSCO benchmark results indicated that a high portion of orthologs were represented in our de novo assembly, with only 5.6% of the expected orthologs missing (Table 2). 	We compared our bitter NLL transcriptome with the publicly available transcriptome of the sweet NLL cultivar Tanjil (BioProject PRJNA248164). 	The Tanjil transcriptome was obtained using Illumina technology and consists of 89 690 contigs, of which 45 739 are predicted to be protein-coding transcripts according to GeneMark S-T predictions. This number represents 65% of the number of protein-coding transcripts in our bitter NLL transcriptome, as predicted using the same analysis (see above). 	1.5052935371460056e-06	2.1052796525154884e-06	0.9999963894268102
PMC5156332	L14679	Introduction	ENA	False	Background	For phage c2, binding to carbohydrate receptors is reversible, and interaction with Pip results in irreversible binding followed by phage DNA ejection (Monteville et al., 1994; Geller et al., 1993). 	The lactococcal Pip protein, first described in L. lactis C2 (GenBank accession number L14679), is a 901 aa membrane-spanning protein encoded by a 2706-bp gene (Geller et al., 1993) with homologues in most Gram-positive bacteria (Mooney et al., 2006); notably Bacillus subtilis orthologue yueB (São-José et al., 2004, 2006). 	It has been reported that inactivation of pip virtually eliminates infection by C2virus in lactococci without any apparent effect on the host (Garbutt et al., 1997; Kraus & Geller, 1998). Similarly, SPP1 requires YueB to infect B. subtilis, where the interaction has been extensively studied (Plisson et al., 2007; Jakuytė et al., 2012). 	0.9063297656417227	5.869624955304591e-07	0.09366964739578171
PMC4344771	AY166807	Results	ENA	False	Use	Other coccidia such as Cyclospora cayetanensis or Cystospora belli as well as other diarrhoea-inducing protozoan parasites such as Giardia lamblia or Entamoeba histolytica were not detected. 	Molecular typing of 32/106 samples revealed that all of them represented Cryptosporidium hominis of the subtype IbA9G2 corresponding to GenBank accession number AY166807. 	nan	0.015275156955488747	0.00024456597291218915	0.984480277071599
PMC3648516	GSE41864	Methods	GEO	False	Creation	Three whitefly DGE libraries (MEAM1, MED and Asia II 3) were sequenced and approximately 6.0 million raw tags were obtained for each library (Table 1). 	After filtering out the low quality reads, the total number of tags per library ranged from 5.7 to 5.9 million and the number of distinct tags ranged from 111,624 to 143,198, which are available at the NCBI Gene Expression Omnibus under the accession number: GSE41864. 	Next, frequencies of distinct tags were used to evaluate the normality of DGE data [47]. Among the three samples, similar distributions of tag numbers were found at different categories of tag expression levels, suggesting that little bias exists in the construction of libraries from these three whitefly species (Figure S1). 	3.4928890963048123e-06	0.7081107211117112	0.29188578599919235
PMC3325407	rs4778138	Results	RefSNP	False	Use	The three haplotype systems we define here are shown in Fig. 1 and Table 3. 	Duffy et al. (2007) previously identified a three-SNP haplotype system (rs4778138, rs4778241, and rs7495174) associated with blue eyes; for the purpose of this paper, we will refer to this system as BEH1, blue-eye associated haplotype #1. 	The blue-eye associated allele of BEH1 is ACA, the fully derived haplotype. Sturm et al. (2008) reported that rs12913832 is associated with blue eyes. 	0.00035856460026559745	2.4551359663796915e-08	0.9996414108483748
PMC5328244	1QMZ	Methods	PDBe	False	Use	Homology modelling of PfCRK4 	The protein kinase domain of PfCRK4 was modelled using the co-crystal structure of the human CDK2-Cyclin A-substrate peptide complex (1QMZ.pdb)25. 	We used this structure as a template in order to model PfCRK4 in a potentially active form. The kinase domains of the target and query sequences were aligned using MUSCLE56 followed by manual review and adjustment. 	2.490759374135909e-09	9.434108667355499e-11	0.9999999974148994
PMC2830475	1YHV	Results	PDBe	True	Use	Two fragments (light gray bars), m/z 1476 and 1579, containing Thr402 disappeared after phosphorylation. 	(b) The differences in solvent accessibility are shown on crystal structure of Pak1 (1YHV.PDB). 	Residues, Trp427 (red) and Gly439 (orange), were statistically coupled to Thr402 (blue). Trp427 and Gly439 were in the fragments m/z 1532 and 1828 that had increased solvent accessibility after autophosphorylation. 	1.111476389050438e-28	1.7766303318660073e-12	0.9999999999982234
PMC4654818	IPR004618	Results	InterPro	False	Use	High levels of expression were also observed for dUTPase, another enzyme predicted to be involved in nucleotide biosynthesis [53]. 	The most highly transcribed metabolic enzyme was an asparagine synthetase A (asnA, THOM_2136, InterPro ID: IPR004618). 	Among Microsporidia, coding sequences for this protein are found on the genomes of T. hominis, V. culicis, Enterocytozoon bienieusi, N. ceranae and Nosema pernyi, and were likely acquired by lateral gene transfer from bacteria [10, 11]. Among eukaryotes, AsnA is almost exclusively found in parasites [10] including Typanosoma brucei and Leishmania donovani, where it is essential for survival [54, 55]. 	0.00021708630522038682	4.2431236680534937e-07	0.9997824893824128
PMC6106943	PRJEB19938	Methods	BioProject	False	Creation	The average gene expression across all genes is displayed by the blue line. b Volcano plot displaying fold changes in expression of the 165 differentially expressed genes between Culicoides sonorensis that are susceptible to infection and those that are refractory to full infection with BTV 	Data (reads, assembly and annotation) have been deposited in the ENA database under the accession number PRJEB19938. 	The genome used in the subsequent analyses is the latest assembly without redundancy removal. Gene model prediction and annotation 	2.423514396196821e-08	0.9999999397846325	3.598022354409436e-08
PMC2928273	rs1799724	Results	RefSNP	False	Use	A similar effect was observed for IL16:rs11556218 (HR:2.28, 95% CI:1.16–4.47). 	Patients with at least one tumor necrosis factor-α (TNF) variant rs1799724 had a nearly 2-fold increased risk (HR:1.97, 95% CI:1.10–3.50). 	Three SNPs in PTGS2 modulated esophagitis risk in our patient population: rs20417, rs5275, and rs689470. PTGS2:rs5275 was associated with an increased risk (P for trend  = 0.014). 	0.002412248749650815	7.206289167879707e-08	0.9975876791874575
PMC5535145	KU572428	Methods	ENA	False	Use	The molecular analysis also included the Tri10 gene responsible for the regulation of multiple Tri genes [50]. 	To design primer/probe sets for the expression of Tri10, the F. culmorum and F. graminearum sequences of the Tri10 gene published in the NCBI database (accession numbers: KU572424 and KU572428) were aligned with Geneious v.6.1.6 (Biomatters Ltd., Auckland, New Zealand, 2014) [63]. 	Due to high polymorphism within the exon-exon boundaries of the Tri10 gene, two Tri10 reverse primers were designed for use in separate reactions: Tri10rc GCC AAT CTC CCC TGC TTA GA (specific for F. culmorum) and Tri10rg GCC AAT CTC CCC TGC TTA GG (specific for F. graminearum). Forward primer: Tri10f CCC TTG CTT GCA TGC TAC AG targeted a conserved binding site. Tri10 primers and Tri10 probe (FAM-CAG TTT TGA GTC TTC G-MGB) were designed using PRIMER EXPRESS 3.0 (Applied Biosystems, Foster City, CA, USA). 	6.781427257895086e-05	0.04545882953878979	0.9544733561886313
PMC6039554	GSE5847	Methods	GEO	False	Use	A clinical diagnosis of IBC was made in 25 of these patients (45). 	Boersma et al., GEO accession number GSE5847, examined primary breast tumor samples from 50 patients, 15 of whom were diagnosed with IBC on the basis of the pathology and medical reports (46). 	Finally, Woodward et al., GEO accession number GSE45584, obtained tissue samples from core biopsies of breast tissue in 40 breast cancer patients, 20 IBC and 20 non-IBC (24). In Iwamoto et al. and Woodward et al., IBC diagnosis was made in patients with clinical presentation of breast erythema and edema over more than one-third of the breast. 	0.0004995145500525989	1.0603227673943812e-06	0.99949942512718
PMC4338595	4NCO	Figure	PDBe	True	Use	nan	A) The structural elements of gp120 are colored on one protomer of the closed, pre-fusion Env trimer (PDB accession code: 4NCO) 10. B) The epitopes of the various NAbs used in this study are highlighted on the structure of the closed, pre-fusion trimer. 	The CD4bs, the target of antibodies b12, VRC01 and PGV04 is shown in orange 8, 21, 22. Glycans at N301 and N332 along the base of V3 make up the PGT123 epitope (magenta) 41. 	7.694082337729643e-27	1.7216348540464168e-14	0.9999999999999827
PMC5750462	1EA3	Results	PDBe	False	Use	Detailed crystallographic data for all four structures (M(NLS-88R)-neutral, M(NLS-88R)-acidic, M(NLS-88E)-neutral and M(NLS-88E)-acidic) obtained are presented in Table 1. 	M(NLS-88R)-neutral occurs as physiological monomers similar to wt-M1 structure 1EA3 (also crystallized at neutral pH),12 and are arranged loosely in a so-called ‘face-to-back’ orientation with each other in the cell (Figure 1A). 	The residues Lys104 (part of the NLS motif), Arg134, Tyr100 and Asp94 on the ‘face’ of one molecule (Monomer A) interact with several complementary residues on the ‘back’ of a second molecule (Monomer B), including Glu29, Asp30, Lys21 and Ser17 (Figures 1A and 1B). Despite also crystallizing at a neutral pH, the two monomers (A and B) of M(NLS-88E)-neutral unexpectedly associate to form a physiological face-to-face dimer with the NLS basic residues adjacent to each other similar to wt-M1 dimer 1AA7 (crystallized at acidic pH).13 The two monomers of M(NLS-88E)-neutral are similar with a root mean square deviation (r.m.s.d.) of ~0.4 Å, but are different from those in wt-M1 1AA7.13 	2.783514939950201e-07	7.217617558143677e-10	0.9999997209267443
PMC6355990	SRP128128	Methods	ENA	False	Creation	nan	Raw sequencing reads and metadata, including SCFA concentrations, are available through the NCBI Short Read Archive under accession number SRP128128. 	nan	1.9066650333278722e-07	0.9999669636179539	3.284571554278377e-05
PMC3569360	GCA_000307715.1	Article	GCA	False	Creation	Nucleotide sequence accession number. 	This whole-genome shotgun project was deposited at GenBank under the accession no. AMQP00000000 (GenBank Assembly ID: GCA_000307715.1; RefSeq Assembly ID: GCF_000307715.1). 	Citation Lefort F, Calmin G, Crovadore J, Osteras M, Farinelli L. 2013. Whole-genome shotgun sequence of Pseudomonas viridiflava, a bacterium species pathogenic to Arabidopsis thaliana. 	3.502118521421932e-09	0.9999997367620457	2.597358356572275e-07
PMC3943257	KC414026	Results	ENA	False	Creation	Molecular Characteristics and Phylogenetic Analysis of CAV Variant 	The complete genome sequence of CAV variant was submitted to GenBank, under the accession number KC414026. 	The CAV variant genome was 2,295 nt long, very close to the genome size (2,316 nt) of the CAV isolated from human fecal samples (accession no. JQ690762). Comparative analyses showed that CAV variant shared the greatest sequence identity (98.1%) with the CAV isolate from Japan (AH9410) and the least identity (38%) with the GyV3 isolate from the USA. 	4.469901768039062e-06	0.9980631803910532	0.0019323497071786146
PMC4226036	KJ201907	Results	ENA	False	Use	nan	The Chrysochromulina tobin chloroplast genome [GenBank:KJ201907] is 104,518 bp in size and has a GC content of 36.3%. 	The genome encodes 145 genes (Figure 2) including 27 tRNA coding genes, 112 protein coding genes and an inverted repeat, with each repeat copy containing the 23S, 16S and 5S rRNA genes. The tRNAs present in this genome represent all potential amino acid anticodons, including a start methionine. 	0.009195440383833197	2.334659641238011e-06	0.9908022249565255
PMC6217397	GSE112174	Methods	GEO	False	Creation	All other samples were run on a HiSeq 4000 instrument and were sequenced to the depth of 50 million paired-end 51-bp reads per sample. 	These RNA-seq data have been deposited in the National Center for Biotechnology Information Gene Expression Omnibus database (accession no. GSE112174). 	nan	2.6616658575761434e-08	0.9999981957672311	1.7776161102756192e-06
PMC5750462	1EA3	Methods	PDBe	False	Use	Diffraction data statistics are shown in Table 1. 	All four M1 mutant structures were determined using molecular replacement with the program PHENIX v.1.9_1692.34 M(NLS-88R)-acidic and M(NLS-88R)-neutral structures were solved using the wt-M1 dimer structure 1AA7 (crystallized at acidic pH)13 and wt-M1 monomer structure 1EA3 (crystallized at neutral pH),12 respectively. 	The two M(NLS-88E) structures were also solved using 1EA3. Refinement and model building were carried out using PHENIX34 and COOT.35 Final refinement of M(NLS-88R)-acidic, M(NLS-88R)-neutral, M(NLS-88E)-acidic and M(NLS-88E)-neutral resulted in Rwork/Rfree of 19.2/23.6, 27.2/32.1, 22.0/31.2 and 22.8/30.8, respectively. 	5.748576785853122e-08	7.059270932780961e-07	0.9999992365871387
PMC2132710	AA218250	Methods	ENA	False	Use	Mouse expressed sequence tag (EST) clone with EMBL/GenBank/DDBJ accession number AA218250 was identified and sequenced; the 3′ end of the 1652-bp clone contained the CVEEHHTFYRLVSPEQPPKTKFLTLGSK motif that overlapped with the 5′ end of the original PCR product. 	Sequencing of additional mouse EST clones (Genome Systems Inc., St. Louis, MO) identified exact match sequence to the PCR product and EST clone AA218250. 	A full-length cDNA was assembled using the following sequence data: AA218250 (bp 1–1521), W83204 (1030–1533), W17544 (1162–1528), PCR product (1441–2907), AA220495 (1807–2173), AA030412 (2554–2964), and AA009193 (2575–2964). To confirm the full-length m4.1G sequence, two pairs of nondegenerate primers were used in PCR experiments to identify overlapping products that covered the full-length cDNA. 	0.0003752907385764974	0.0003030465365332133	0.9993216627248902
PMC4107892	GU727556	Article	ENA	False	Use	Two cultures listed in the CBS collection as E. subulatus (CBS 458.88 and CBS 139.90) were found to be phylogenetically and morphologically distinct (Figs 1 & 6, respectively) and represent different taxa. 	Highest similarity of the LSU sequences was found with “Mollisia incrustata” GenBank GU727556; however, this sequence does not appear to be congeneric with other Mollisia sequences on GenBank (data not shown) and thus the application of the supposed taxonomic lineage of Mollisia (Leotiomycetes; Helotiales; Dermateaceae) would not be confirmed here. 	Examination of the blast results also did not result in a clear affinity to any of the classes, with a more or less equal similarity to both Leotiomycetes and Sordariomycetes and therefore this genus is treated here as incertae sedis. It is quite possible that the genus belongs to a class that is currently not represented in the NCBI GenBank nucleotide database. 	2.138343756730841e-06	6.44680128375834e-06	0.9999914148549595
PMC6341276	1Q1M	Figure	PDBe	True	Use	nan	(a) Superimposed structures of PTP1B (PDB ID: 1Q1M) and TCPTP (PDB ID: 1L8K) which are shown in blue and red, respectively. 	The inhibitor is shown by ball-and-stick with a transparent surface. (b) Structure of the inhibitor labeled with oxygen and nitrogen atoms. 	1.1622521957681973e-28	6.1953959381083675e-18	1.0
PMC4799242	KJ577821	Results	ENA	False	Creation	The sequences were 100 % homologous to each other and to the gltA sequences of Rickettsia helvetica (GeneBank acc nos. JX627379, KF447530, KC007126, JX040636, and AM418450). 	The consensus sequence (370 bp) was deposited in GenBank under acc. no. KJ577821. 	Moreover, the three positive samples were re-run and specific fragments of 16S rRNA gene of Rickettsia spp. were successfully amplified and sequenced. Also these sequences were identical and they shared 100 % similarity to four of R. helvetica sequences available in GenBank: GQ413963; AF394904, AF394905; L36212. 	1.094910882727775e-05	0.9990815470545611	0.0009075038366117936
