PMCID	AccessionNb	Section	SubType	Figure	Categories	PreCitation	Citation	PostCitation	Background	Creation	Use
PMC5592930	KT722338	Results	ENA	False	Use	While natural and experimental hybridization has been documented between the bobwhite and the scaled quail (Johnsgard 1970; Shupe 1990), the extent of historic hybridization has not been estimated using nuclear, genome-wide variation. 	However, a recent mitochondrial population study for the bobwhite (n = 53), which also produced a complete scaled quail mitochondrial genome for comparison (GenBank accession KT722338), failed to detect any evidence of historic hybridization (bobwhite ♂ × scaled quail ♀), despite sampling from regions where both species naturally occur (Halley et al. 2015). 	A subset of the nuclear microsatellites presented here may prove useful to facilitate low-cost investigations of management concerns using larger sample sizes, including issues related to population structure, gene flow, and nuclear introgression between the scaled quail and bobwhite. Beyond microsatellite loci, we also predicted genome-wide autosomal sequence variation resulting from biparental inheritance of alternative alleles (heterozygosity) for the scaled quail (v1.0) and the bobwhite (v2.0). 	0.0009902977156197436	1.6938582823759563e-05	0.9989927637015565
PMC5813109	KX345847	Discussion	ENA	False	Creation	Nucleotide sequence accession number 	The nucleotide sequences of CSF\BGD\DO1LT\2015 strain was deposited in GenBank under accession number KX345847. 	nan	2.8103369217201983e-12	0.9999999999966309	5.587018528618412e-13
PMC3499474	P17563	Results	UniProt	False	Use	The immunoblot procedure does not always define all the possible residues subjected to posttranslational modifications. 	As shown in Figure 6, the phosphoserine specific MAbs pSset recognized aldehyde dehydrogenase (P47738) and selenium-binding protein 1 (P17563), but with the MAbs 4G10, MPM-2 and pYset only one of these proteins were detected. 	These two proteins are phosphorylated at different sites as reported elsewhere. Thus, by use of several anti-phosphoprotein Abs with different specificity in the recognition of epitopes a more comprehensive characterization of phosphoproteins can be achieved. 	1.079797654681578e-05	1.1041858907706746e-07	0.9999890916048642
PMC3325407	rs1800414	Discussion	RefSNP	False	Use	Another possible explanation is that the blue eye phenotype is not being selected for; rather the TG allele of BEH2 has another phenotype, such as lighter skin pigmentation, which is under selection. 	In East Asia, we show that the C allele of the missense SNP rs1800414 is also under selection (Fig. 10). 	Again this result is not completely unexpected since this allele has been associated with lighter skin pigmentation in East Asians, and variants affecting skin pigmentation have previously been shown to be targets of selection (Edwards et al. 2010; Izagirre et al. 2006; Lao et al. 2007; Norton et al. 2007). 	0.13143795028331529	9.435507965073439e-07	0.8685611061658882
PMC2830475	1ATP	Results	PDBe	True	Use	(b) Five specific reciprocal coupling pairs were superimposed on the same structure. 	(c) Four specific reciprocal coupling pairs for PKA were identified on the PKA structure (1ATP.PDB). 	(d) Two specific reciprocal coupling pairs in Src were shown on 2SRC.PDB. The same color was used when two residues were reciprocally coupled. 	1.1144790329148584e-25	2.7488918396792397e-11	0.9999999999725111
PMC6406689	rs9545409	Results	RefSNP	False	Use	The analysis yielded a 3-SNP haplotype showing statistical interactions with maternal multivitamin supplementation: A-A-A for rs496932-rs9545412-rs9669948 (p-value = 3.43 × 10−5), located in SPRY2, with a frequency of 10.9%. 	For the interaction with maternal ETS, a 2-SNP haplotype and two 3-SNP haplotypes showed significant interactions with ETS after Bonferroni correction, with T-A-G for rs541731-rs9531050-rs9545409 showing the lowest p-value (p-value = 9.18 × 10−5). Table 2 presents the results of the interaction analysis. 	nan	8.740987586817453e-07	1.8340114454149156e-08	0.999999107561127
PMC4226036	C19847	Results	ENA	False	Use	However, C. tobin has only tRNA alanine in inverted repeat A, and tRNA isoleucine in inverted repeat B (Figure 4). 	This pattern is also likely present in the uncultured prymnesiophyte C19847. 	Only a single operon was assembled for this organism, but that operon solely contained tRNA-Ile within the ISR. Interestingly, the C19847 ribosomal operon that is adjacent to the petB gene contains a tRNA-Ile, while the ribosomal operon adjacent to petB in C. tobin contains tRNA-Ala. 	5.204308928794935e-05	1.3624525111849012e-06	0.9999465944582009
PMC5256176	RRID:SCR_004817	Methods	RRID	False	Use	Diffusion data reconstruction for tractography 	DiffusionToolkit/TrackVis (RRID:SCR_004817; trackvis.org) was used to reconstruct and visualize tractography pathways. 	Tractography pathways were reconstructed using a HARDI (Q‐ball) model with a streamline algorithm and a 45° angle threshold. No threshold of fractional anisotropy (FA) was used for the fiber reconstruction as in our previous research studies (Takahashi et al., 2013). 	6.734723640404946e-05	1.6153955366851306e-05	0.999916498808229
PMC3235092	CU989003	Methods	ENA	False	Use	5′-RACE PCR and primer walking 	In silico analysis within the ‘Gigasdatabase’ oyster Crassostrea gigas EST database [32] revealed that three sequences produce significant homologies with the Angiotensin-converting enzyme (GenBank Accession numbers: CU989003, CU992640 and FP010921). 	These sequences were used to design oligonucleotides which were used downstream in 5′-RACE and primer walking strategies for the characterisation of the whole sequence of the ACE orthologue in C. gigas, named CgACE. Five prime rapid amplification of cDNA ends (5′-RACE) was performed on spat cDNA (Generacer kit, Invitrogen). 	0.0036572869227022857	0.2797008779185873	0.7166418351587105
PMC5564536	KC896287	Results	ENA	False	Use	Subcellular distribution of Eriocheir sinensis SOX14A and SOX14B in cultured cells 	Our clone of the Eriocheir sinensis Sox14a (GenBank accession no. KC896287) and Sox14b genes (GenBank accession no. KC896286) together with the structure and functional domains of these two transcription factors are shown in Figure 1A (Supplementary Figure 1A, 1B). 	The amino acids of the HMG box in Eriocheir sinensis SOX14A and SOX14B and Homo sapiens SOX14 are highly conserved. Multiple sequence alignments have indicated that both the HMG box of SOX14A and SOX14B are evolutionarily conserved with other SOX proteins in both H. sapiens and M. musculus (Figure 1B, Supplementary Figure 2A, 2B). 	7.013377412108943e-05	6.841882660345139e-05	0.9998614473992755
PMC6273887	KX429691	Results	ENA	False	Creation	Therefore, there were at least three members in O. caudatum UGlcAE family (Figure 1). 	The three full-length OcUGlcAE genes were hence deposited in GenBank library with accession numbers of KX429689, KX429690 and KX429691 (Table 2). 	nan	3.287826835641581e-05	0.9953386800974295	0.004628441634214129
PMC4970815	ERR315856	Results	ENA	False	Use	This database contains approximately 10 million protein sequences, which comprise a total of approximately 3.6 billion residues. 	For the query sequences, we used 3 datasets: metagenomic sequences of a soil microbiome (accession number SRR407548, read length 150 bp), metagenomic sequences of a human microbiome (accession number SRS011098, read length 101 bp), and metagenomic sequences of a marine microbiome (accession number ERR315856, read length 104 bp). 	SRR407548 and ERR315856 were obtained from the DNA Data Bank of Japan (DDBJ) Sequence Read Archive. SRS011098 was obtained from the web site of the Data Analysis and Coordination Center for the Human Microbiome Project (http://www.hmpdacc.org/). 	3.0717074503013335e-06	0.018365553919438525	0.9816313743731112
PMC4799242	JX627379	Results	ENA	False	Use	Two I. ricinus females (Table 2) from Rhinolophus hipposideros and one I. ricinus female from M. myotis were PCR-positive for the rickettsial gltA gene. 	The sequences were 100 % homologous to each other and to the gltA sequences of Rickettsia helvetica (GeneBank acc nos. JX627379, KF447530, KC007126, JX040636, and AM418450). 	The consensus sequence (370 bp) was deposited in GenBank under acc. no. KJ577821. Moreover, the three positive samples were re-run and specific fragments of 16S rRNA gene of Rickettsia spp. were successfully amplified and sequenced. 	2.8714526149287295e-06	2.195305299931491e-05	0.9999751754943856
PMC3338528	CP002339	Methods	ENA	False	Creation	nan	The complete genome sequence of strain SN2 has been deposited in GenBank under accession no. CP002339. 	nan	9.037815751724929e-14	0.9999999999999096	1.7099413328953202e-17
PMC6121541	SRX3822957	Methods	ENA	False	Creation	The sequencing library was prepared using 5 μg of RNA from each sample (PH-FB for mix floral buds or PH-LF for mature leaves) and sequenced by using the Illumina HiSeqTM 2000 high throughput sequencing platform with paired-end technology following the manufacturer’s instructions. 	After removing the adaptor sequences, empty reads, and low-quality sequences, a large number of high-quality reads were obtained, and the resultant datasets are available in the NCBI Sequence Read Archive (SRA) under the accession numbers SRX3822957 and SRX3822958 for PH-FB and PH-LF transcriptome datasets, respectively. 	After combining the high-quality clean reads from PH-FB and PH-LF transcriptome datasets, the de novo assembly was performed using the Trinity de novo program to generate the ALL transcriptome datasets [83]. The functions of the assembled transcripts (contigs and unigenes) were first aligned by BlastX to the protein databases of NR, Swiss-Port, KEGG, and COG specifying the E-values of less than 10−5. 	5.8092926457825815e-09	0.9896613199610613	0.010338674229646082
PMC4338595	4NCO	Figure	PDBe	True	Use	Individual plots for the peptides at V1/V2 and V3 are shown in Figure 6, and plots for every peptide are in Supplementary Figures 1 and 2. 	C, D) Differences are mapped onto the closed, pre-fusion trimer crystal structure (PDB accession code: 4NCO) 10, with regions of faster (red) or slower exchange (blue) in the presence of each antibody highlighted. 	Segments unresolved in the crystal structure (V2, V4, and FPPR) are shown as dashed lines. As a reference, the binding surfaces of each bNAb on gp120 are shown in green (PDB: 3NGB, 2NY7) 21, 22. 	1.2211642834106876e-26	1.365307551860257e-13	0.9999999999998634
PMC5598801	rs8330	Results	RefSNP	False	Use	No association of specific glucuronidator phenotypes was found between male and female volunteers (χ2 = 0.582; P = 0.748). 	For SNP rs8330, the frequency distribution data of slow and intermediate glucuronidator phenotypes and the associated genotypes for male and female volunteers are given in Tables 5 and 6, respectively. 	The comparative data of genotypes for SNP rs10929303 and associated glucuronidator phenotypes in male and female volunteers are shown in Tables 7 and 8, respectively. 	3.2294121789038357e-10	9.59381672886869e-10	0.9999999987176771
PMC3325407	rs12914687	Results	RefSNP	False	Use	On average, globally we see two regions of high LD, though the sizes of each of these regions vary by population group. 	In Africa, the first region encompasses SNP 4 (rs12914687) through SNP 7 (rs2015343) and the second region encompasses SNP 16 (rs7494942) through SNP 21 (rs1667394). 	In Southwest Asia and Europe, both high LD regions are larger and the first is composed of SNP 3 (rs11074314) through SNP 8 (rs4778136), and the second is composed of SNP 12 (rs4778138) through SNP 21 (rs1667394). In Central Asia and the Pacific, the first region is the same as in Africa and the second region is the same as in Southwest Asia and Europe. 	2.2378360313698814e-06	3.084141750315953e-09	0.9999977590798268
PMC5192062	614891	Article	OMIM	False	Background	IL-23 binds to its receptor complex (IL-12Rβ1 and IL-23R) on Th17 cells and has an important role in maintenance of Th17 cells and induction of IL-17 and IL-22. 	AR-complete IL-12Rβ1 deficiency (OMIM ID: 614891) is the most common genetic cause of MSMD, explaining 44% of MSMD patients with a known genetic etiology.48 The first cases of AR-complete IL-12Rβ1 deficiency were reported in 1998.27, 28 From the first identification, a total of 180 patients from 136 kindreds have since been reported.48 A large cohort study, collecting 141 patients from 102 kindreds with AR-complete IL-12Rβ1 deficiency, revealed its heterogeneous clinical manifestations. 	Mycobacterial disease (83%), Salmonellosis (43%) and CMC (23%) were the three major infectious phenotypes reported in symptomatic patients.11 Moreover, 78% of BCG-vaccinated patients developed BCG disease. In contrast, 8 of the 29 genetically affected siblings were asymptomatic (27%), suggesting incomplete penetrance of this disorder. 	0.9998934269892673	2.0457718150227737e-07	0.00010636843355132019
PMC5061317	FJ202015	Methods	ENA	False	Use	The correct product was cloned into an expression vector as previously described (Yueh et al., 2005). 	To construct an expression vector harboring canine CAR3, reference CAR sequence (CAR1) for canine (Accession number: FJ202015) was amplified from C. familiaris liver cDNA. 	PCR conditions were 98°C for 2 min, 30 cycles of 98°C for 30 sec and 72°C for 1 min, followed by 72°C for 7 min and cooling to 4°C. The resulting PCR product was cloned into the pCR2.1 vector for sequence analysis and subsequently cloned into a pCDNA 3.1 expression vector (Life Technologies, Carlsbad, CA). 	0.0003031092323656159	8.389793682649837e-06	0.9996885009739518
PMC5687643	NC_000007.14	Results	RefSeq	False	Use	DNA sequence analysis of the AKR1B10 promoter region, a gene frequently silenced in inflammatory bowel disease and colorectal cancer [31, 32], revealed a repetitive sequence composed of tandem 4-nucleotide repeats, (TTCC)2(TCCC)5(TCCT)7, with a flanking C and T- enriched sequence (Figure 1A). 	This repetitive sequence is located at Chromosome 7 q33 (NC_000007.14, nucleotide number 134526936 - 134527095) (Figure 1B). 	In this study, we used this sequence as a reference sequence. 	0.0023891043599861502	5.233969040976916e-05	0.997558555949604
PMC6404619	JG970650	Results	ENA	False	Use	nan	The orthologous genes in cassava, hop, and mangrove have expressed sequence tags (NCBI JG970650.1, ES653410.1, DB992577.1) mapping to the miR5225/3627/4376 target site and downstream through the translation start site, suggesting calcium-ATPase10 intron2 is mis-annotated. 	Although vvi-MIR482 expression was not significantly changed by UV treatment in in vitro plantlets (P = 0.21, possibly due to small sample size and high read number), PhaseTank analysis revealed a non-coding phasi-RNA candidate TAS locus (chr13:15496204-15497757) (ShortStack phase score 1,737) generating a tasiRNA [3′D3(-)] by vvi-miR482 cleavage (Allen score = 5.0; P < 0.07) (Supplementary Table 4 and File S5). This novel candidate TAS locus significantly up-regulated by UV treatment (Supplementary Table 3a) was named vvi-TAS11 following the nomenclature of Zhang et al. (2012). 	0.0005433738681357113	0.0361120455063441	0.9633445806255202
PMC3254606	2ABL	Results	PDBe	False	Use	Sequence alignment structural similarities are shown in figure 6A, B, and C respectively. 	We also performed the virtual docking experiments between the structure of SH2 domain of CrkL and the structure of Bcr-Abl (PDB code: 2ABL). 	nan	3.3628534993542205e-08	1.3250237680870234e-06	0.999998641347697
PMC3892923	1FC2	Results	PDBe	False	Use	The first protein (the native structure) in each set has RDCC below the 0.012 Å cutoff. 	Superimposition of the native structure and a decoy structure (AXPROA00-MIN) for a protein (PDBid:1FC2) taken from the fisa decoy set. 	The native structure is in red, and the decoy structure is in green. The structures are superimposed using MUSTANG 58. 	0.00014444765954181875	3.342583604827459e-07	0.9998552180820978
PMC4724163	SRP067309	Methods	ENA	False	Use	Sequencing was carried out using a 300 cycle V2 SBS kit (Illumina, Inc.) in paired-end 150 bp format. 	Over 350 Mbp of sequence data were obtained from 2.69 million paired reads with a mean length of 137 bp (standard deviation of 26.3) and were submitted to the Short Read Archive [SRA:SRP067309]. 	Reads were trimmed to an error probability limit of 0.5 % and de novo assembly was performed using medium-low default sensitivity settings on the bioinformatics package Geneious version 6.1.7 [37] (Biomatters Ltd). This yielded four large contigs (52.6 kbp, 37.3 kbp, 14.9 kbp and 17 kbp) with consensus sequences that corresponded to herpesvirus sequence, according to Blastx and Blastn searches of GenBank databases [38, 39]. 	3.721092517775838e-05	0.05156432164064676	0.9483984674341756
PMC3254606	2EO3	Results	PDBe	False	Use	Interestingly, we observed that the sequence of apoptin was somewhat similar (identical residues 21.7%, and similarity 40.6%) to that of SH2 domain of CrkL, and apoptin's proline-rich segment (aa: 81–88) was found to be within this aligned region of SH2 domain. 	We then compared the shape of known 3D structure (PDB code: 2EO3) of SH2 domain of CrkL and apoptin model. 	Sequence alignment structural similarities are shown in figure 6A, B, and C respectively. We also performed the virtual docking experiments between the structure of SH2 domain of CrkL and the structure of Bcr-Abl (PDB code: 2ABL). 	3.9277324466588585e-06	1.033982913814054e-09	0.9999960712335704
PMC2585009	P20591	Results	UniProt	False	Use	To address this issue, levels of Mx1 protein (Swiss-Prot ID: P20591) were measured. 	Mx1 (Swiss-Prot ID: P20591), an antiviral interferon-stimulated gene, is a relatively stable, sensitive marker for low levels of interferon and innate immune activation [51]. 	Although treatment of macrophages through multiple TLRs 4, 3, or 8 for 24 hours stimulated increased intracellular levels of the Mx1 protein, treatment by HIV-1 induced no expression of Mx1 protein (Fig. 9). Although macrophages recognize and respond to TLR agonists via MyD88-dependent or independent pathways, HIV-1 has no apparent impact on targets downstream in TLR signaling through either pathway. 	0.0034012438338264068	2.1499579757109166e-08	0.9965987346665939
PMC6278402	E3EEN8	Results	UniProt	False	Use	As shown in Table 1, ten peptides were retrieved and assigned to four pectate lyases, which belonged to PL families 1, 3, 9, and 10, respectively, predicted using the CAZy database (http://www.cazy.org/) [19]. 	The amino acid sequence of the protein with UniProt accession number E3EEN8 (NCBI protein ID WP_013370345.1) was consistent with a PL family 10 pectate lyase. 	The PL10 enzyme showed the highest intensity in LC-MS/MS analysis (Table 1), which suggested that the enzyme may be a major component of the pectin-degrading enzymes of P. polymyxa KF-1. Only five pectate lyases belonging to PL family 10 have been characterized, including PelA from B. alcalophillus NTT33 [20], Pel-15E from Bacillus spp. strain KSM-P15 [21], PelA from Azospirillum irakense [22], rPelA from Treponema pectinovorum ATCC 33768 [23], and r-PL_D from Xanthomonas campestris ACCC 10048 [24]. 	1.1257488217458346e-05	1.488869806146195e-06	0.9999872536419764
PMC3858281	1PJM	Results	PDBe	False	Use	Residues 6–15 of Prp20 could not be discerned from the electron density, a common observation for bipartite NLSs with long linker regions [6] and these residues were omitted from the final model. 	The 425 residues comprising IMPαΔIBB are structured into 10 ARM repeats, with an overall arrangement similar to that of available IMPα structures (e.g. RMSD for the equivalent Cα residues from the structures with PDB IDs EJY, 1EJL, 1PJM are 0.28, 0.29, and 0.30 Å, respectively). 	The interaction between IMPα and the Prp20 NLS is made through an extensive array of contacts involving residues contained with ARM repeats 2 through 7, utilising both the major and minor NLS binding sites of IMPα to contact Prp20NLSRAKKMSK23 and the canonical Prp20NLSKR4 motif, respectively, and exhibiting a total of 1,091 Å2 buried surface area. One notable feature of the major site is the insertion of Prp20NLSAla18 between the P0 and P1 NLS positions, noted in only a few classical bipartite NLSs. 	0.00946190191215047	4.626175362480744e-07	0.9905376354703134
PMC5703901	1COY	Methods	PDBe	False	Use	The three-dimensional (3D) homology model of PsChO was generated using Modeller 9.929. 	The crystal structure of cholesterol oxidase from Brevibacterium sterolicum (PDB ID: 1COY, 1.8 Å), which has 66% sequence identity to the target protein PsChO, was chosen as the template. 	The align2d command was used to automatically generate a sequence alignment between the template and PsChO. Subsequently, homology modeling was performed by the automodel command. 	7.957406598361207e-06	2.2314525370070778e-08	0.9999920202788762
PMC4790474	KU513965	Methods	ENA	False	Use	The cDNA preparations obtained were used to amplify AtHCT (GenBank accession No. 	NP_199704.1/At5g48930) and PpHCT1 (http://www.cosmoss.org, accession No. Pp3c2_29140V1.1; GenBank accession No. KU513965) using the oligonucleotides AtHCT-B1/AtHCT-B2 and PpHCT-B1/PpHCT-B2 (Supplementary Table S6), respectively, for cloning into the Gateway pDONR221 entry vector by BP recombination (Life Technologies). 	Gene sequences encoding for PtHCT6 (NCBI reference sequence XP_006368492.1), PvHCT2a (GenBank accession No. AGM90558.1), PrHCT (GenBank accession No. ABO52899.1) and SmHCT (NCBI reference sequence: XP_002991534.1), flanked with the attB1 (5′ end) and attB2 (3′ end) Gateway recombination sites, were synthesized for expression in yeast (GenScript) and cloned into the Gateway pDONR221 entry vector by BP recombination (Life Technologies). All six entry clones were LR recombined with the pDRf1-4CL5-GW vector (Eudes et al. 2011) to generate the constructs pDRf1-4CL5-AtHCT, pDRf1-4CL5-PtHCT6, pDRf1-4CL5-PvHCT2a, pDRf1-4CL5-PrHCT, pDRf1-4CL5-SmHCT, and pDRf1-4CL5-PpHCT1. 	7.499352283658978e-10	1.9353315171426977e-05	0.9999806459348933
PMC3254606	2ABL	Methods	PDBe	False	Use	One of the best apoptin models was used to examine the solvent accessible surface area. 	A docking file with pdb extension of apoptin molecule was prepared without hydrogen atom to perform molecular docking p17experiments to examine the interaction between apoptin model and the Bcr-Abl oncoprotein using 3D structure of the protein (PDB code: 2ABL). 	nan	8.586121007167276e-09	4.088518551328234e-08	0.9999999505286934
PMC6166924	rs1801131	Discussion	RefSNP	False	Use	Our results showed a significant association between MTHFR SNP rs1801131 and SN, supporting the suggestion of a role of variation in this gene and ART toxicity. 	SNP rs1801131 or A1298C causes a glu429-to-ala (E429A) substitution which decreases MTHFR activity [43], which theoretically would cause increased thymidylate synthetase levels and decreased d4T toxicity. 	This is consistent with our finding of a protective effect of rs1801131 against SN. Ribonucleotide reductase (RNR) catalyses the formation of deoxyribonucleotides from ribonucleotides [44] and therefore plays a critical role in de novo DNA synthesis and cell proliferation The tetrameric enzyme is composed of large RNR1 and small RNR2 subunits encoded by the RRM1 or RRM2 genes. 	0.000722345258912509	7.078007087526801e-10	0.9992776540332867
PMC5811607	GSE109471	Methods	GEO	False	Creation	Gene expression data for primary human small intestine (duodenum, jejunum, and ileum), Caco-2 Gut Chip, and Caco-2 Transwell were obtained from the National Center for Biotechnology Information (NCBI) Gene Expression Omnibus (GEO) database55 (accession no. GSE6579021). 	Transcriptome profiles of duodenal organoids and primary Intestine Chip performed in this study were deposited to the NCBI GEO database (accession no. GSE109471). 	Global gene expression profiles were visually represented using self-organizing maps generated using the Gene Expression Dynamics Inspector (GEDI) program56. In GEDI, each pixel tile within a mosaic represents a minicluster of genes that have highly similar expression patterns across all analyzed samples. 	9.202390778449698e-11	0.9999814030356091	1.8596872366860976e-05
PMC5333524	DRA003930	Article	ENA	False	Use	nan	Small RNA-seq raw data has been deposited in the DDBJ sequence read archive (DRA) under accession numbers DRA003930 and DRA004107 (CC-124 replicate #1, DRX040414; CC-124 replicate #2, CCDRX040415; Gluc1(×) replicate #1, DRX040416; Gluc1(×) replicate #2, DRX040417; ago3–1 replicate#1, DRR045098; ago3–1 replicate#2 DRR045099; dus16–1 replicate #1, DRX043778; and dus16–1 replicate #2, DRX043779). 	nan	0.00026047858132246393	0.0003169041775917369	0.9994226172410857
PMC5960700	KY680280	Methods	ENA	False	Use	The MiCV HEB15 strain was isolated previously by our team (GenBank Accession No. KX268345) and used as the positive control for the qPCR and conventional PCR assay. 	Negative controls to test the specificity of qPCR included AMDV and DogCV isolated by our laboratory from Heilongjiang Province, respectively (GenBank accession No. KY680280 and No. MF797786). 	The porcine circovirus 1 (PCV1) and PCV2 were obtained from Dr. Yanwu Wei, Harbin Veterinary Research Institute, the Chinese Academy of Agricultural Sciences (Huang et al., 2012; Wang et al., 2015c). The mink calicivirus (MCV), pseudorabies virus (PRV), rabies virus (RV) and canine adenovirus type 2 (CAV2) were obtained from Dr. Yongjun Wen (Yang et al., 2012), Dr. Tongqing An (Ye et al., 2015), Dr. Jinying Ge (Guo et al., 2009), and Dr. Jiang Qian (Yu et al., 2015), respectively. 	2.5986605285152554e-07	0.00010098962075066114	0.9998987505131964
