PMCID	AccessionNb	Section	SubType	Figure	Categories	PreCitation	Citation	PostCitation	Background	Creation	Use
PMC4190355	rs2243250	Introduction	RefSNP	False	Use	The human IL-4 gene is located on chromosome 5q31 and consists of 25 kbps [16]. 	So far, more than 50 allelic variant polymorphisms have been found (http://www.ncbi.nlm.nih.gov/SNP/), including −590C/T (rs2243250), −33C/T (rs2070874), +3437C/G (rs2227282), and 2979G/T (rs2227284) [17]. 	The impact of IL-4 gene polymorphisms in the pathogenesis of HBV infection has been investigated, and numerous studies have suggested that IL-4 variants play pivotal roles in hepatitis B vaccine response and HBV infection risk [18]–[21]. However, to date, few studies have been conducted to investigate the role of these polymorphisms in HCC development [22]. 	0.056173930744024436	4.397830109928998e-07	0.9438256294729644
PMC4682451	120435	Introduction	OMIM	False	Background	nan	Lynch syndrome (MIM #120435) predisposes to the development of colorectal, endometrial, and other cancers [Lynch and de la Chapelle, 2003]. 	It is most commonly caused by constitutional heterozygous loss-of-function mutations in the DNA mismatch repair (MMR) genes, usually MLH1 (MIM #120436) or MSH2 (MIM #609309) [Lynch et al., 2009]. The reported mutations in Lynch syndrome families are genetically heterogeneous and include gross structural alterations such as deletions or inversions, [Wagner et al., 2002] missense, nonsense or frameshift mutations, [Tavtigian et al., 2008] splice site mutations, [Thompson et al., 2014] or variants within MMR gene regulatory regions such as promoter regions [Green et al., 2003]. 	0.9994673308886322	1.9523254320647697e-08	0.0005326495881134269
PMC5122352	rs2853677	Results	RefSNP	False	Use	The TERT gene encodes the catalytic subunit of telomerase, the ribonucleoprotein complex that maintains telomere length. 	To test whether rs2853677 resides in a cis-regulatory element of TERT, a 600 bp fragment encompassing the rs2853677 was amplified from human A549 cellular DNA that carries the T/C genotype of rs2853677. 	PCR products with the T or C allele were inserted into a construct containing a luciferase reporter gene, upstream of the TERT promoter in the original or inverted orientation. Luciferase reporter constructs were transfected into HEK293 cells, and the − 518 to + 10 fragment exhibited basal promoter activity. 	9.148340109864214e-07	3.0369520712827014e-09	0.999999082129037
PMC3447400	1ii6	Results	PDBe	False	Use	Ispinesib occupies the inhibitor-binding pocket formed by helix α2, loop L5 and helix α3 (Fig. 3 ▶ a). 	Comparison with apo Eg5 (PDB entry 1ii6; Turner et al., 2001 ▶) shows that the region around the inhibitor-binding pocket undergoes major conformational changes on ispinesib binding. 	Additional changes extend towards the other end of the motor domain, bringing about larger conformational changes in the switch II cluster (helix α4, loop L12 and helix α5) and the neck-linker region (Yan et al., 2004 ▶). All four molecules in the asymmetric unit depict the final ispinesib-bound state. 	0.04624261261903917	2.54183499701883e-06	0.9537548455459639
PMC4724163	KT594769	Methods	ENA	False	Creation	Availability of supporting data 	The MaHV-1 genome sequence data has been submitted to GenBank and the accession number is KT594769. 	The Illumina read data have been submitted to the Short Reads Archive database and has the ID number SRA:SRP067309. 	5.230270517711873e-07	0.9999994598612492	1.7111698968325515e-08
PMC5750462	1EA3	Methods	PDBe	False	Use	All four M1 mutant structures were determined using molecular replacement with the program PHENIX v.1.9_1692.34 M(NLS-88R)-acidic and M(NLS-88R)-neutral structures were solved using the wt-M1 dimer structure 1AA7 (crystallized at acidic pH)13 and wt-M1 monomer structure 1EA3 (crystallized at neutral pH),12 respectively. 	The two M(NLS-88E) structures were also solved using 1EA3. 	Refinement and model building were carried out using PHENIX34 and COOT.35 Final refinement of M(NLS-88R)-acidic, M(NLS-88R)-neutral, M(NLS-88E)-acidic and M(NLS-88E)-neutral resulted in Rwork/Rfree of 19.2/23.6, 27.2/32.1, 22.0/31.2 and 22.8/30.8, respectively. Refinement statistics are summarized in Table 1. 	8.120482880995878e-08	1.334772921926655e-07	0.9999997853178789
PMC4564166	605179	Results	OMIM	False	Use	Variant prioritization and analysis 	One synonymous de novo SNV, located in NR4A2 (Table 1, RefSeq NM_006186.3, MIM:601828; c.779G>T [p.S119]) and one de novo insertion in the ORF GAS8-AS1 (Table 1, RefSeq NC_000016.10, MIM:605179; g.90095617_90095618insCTGCGGGGCAGC) were found in the proband of Fam10. 	The possible effect of the synonymous variant on mRNA stability was analyzed using SilVA [47], as in O’Roak, B.J. et al., 2012 another synonymous variant was reported in this gene [10], and ESEfinder for possible de novo splicing regions [48,49], but no effects on mRNA stability or possible new splice sites were found (Table 2). The insertion in GAS8-AS1 (Table 1) was analyzed using ESEfinder to determine if it might alter GAS8 gene (MIM:605178) splice since it is located in intron 2. 	1.3115306866236475e-07	6.292791962298309e-08	0.9999998059190117
PMC3703906	X54079	Methods	ENA	False	Use	nan	The mRNA target sequences to Hsp27 (GeneBank Accession no. X54079.1) and c-FLIP (Gene ID: 8837) were designed using a siRNA template design tool (Ambion, Austin, TX, USA), and siRNA was prepared with a Silencer siRNA construction kit (Ambion). 	Three oligonucleotides Hsp27-1 (5′-GACCUACCGAGGAGCUUUCdTT-3′), Hsp27-2 (5′-UCGAGGCCCUGUAACUUG-3′), and Hsp27-3 (5′-CAGUAGUUCGGACAAACGAAGA-3′) were designed based on the publicly released Hsp27 DNA sequence and another three oligonucleotides FLIP-1, FLIP-2, and FLIP-3 designed for c-FLIP. The siRNAs were transfected into PC-3 cells with Lipofectamine 2000 (Invitrogen) employing 50 nM in 250 μL Opti-MEM medium/60 mm culture dish. 	0.00016488671030350066	2.013194214470787e-06	0.999833100095482
PMC4178425	CJJ81176	Results	ENA	False	Use	This oxidoreductase has 28% protein sequence identity with Cj0264c and may catalyze the reduction of DMSO / TMAO as well. 	The dmsA gene (cju34 / cjj81176_1570) of C. jejuni 81–176 is organized in a gene cluster together with three other gene genes encoding for the iron-sulfur containing DMSO reductase subunit DmsB (CJJ81176_1571), the DMSO reductase anchor subunit DmsC (CJJ81176_1572) and chaperon protein TorD (CJJ81176_1572) that are predicted to participate with DmsA at the electron transfer to DMSO / TMAO or other S- and N-oxides (Hofreuter et al., 2006). 	Several human pathogens harbor nitrate and nitrite respiration systems (Sparacino-Watkins et al., 2014). C. jejuni encodes for the periplasmic located Nap-type nitrate reductase (Cj0780-Cj0785) catalyzing the reduction of nitrate to nitrite (Pittman and Kelly, 2005). Nitrite can subsequently be used as electron acceptor and reduced to ammonia by C. jejuni through the concerted activity of the pentaheme nitrite reductase NrfA (Cj1357c) and the electron donor protein NrfH (Cj1358c) of the tetraheme NapC/NirT cytochrome C family (Pittman et al., 2007). 	0.4092075780518925	2.3627985906233493e-05	0.5907687939622012
PMC4779890	GSE10482	Methods	GEO	False	Creation	nan	All raw expression data are available at Gene Expression Omnibus (GEO) (Identifier: GSE10482). 	Using normalized data significantly activated or repressed genes were selected by Rank Products analyses (Breitling et al., 2004). The number of random permutations used for estimation of false discovery rates (FDR) was 5. 	2.124767376338752e-05	0.7640775683044391	0.23590118402179755
PMC3643936	GO:0007049	Results	Gene Ontology (GO)	False	Use	Furthermore several genetic interactions between these central genes also have high edge betweenness coefficients. 	Individually, both subgraphs are significantly enriched for genes involved in DNA replication and cell cycle control (GO:0006260 and GO:0007049). 	However, by combining these two subgraphs 81 new functional links are made between GO terms that are not co-enriched in subgraphs from any single network but are co-enriched when subgraphs from different networks are combined. Specifically, presence of Sir2 family genes (YOR025W and YDR191W) that are NAD(+)-dependent histone deacetylases involved in cell cycle progression [19] cause the new links, such as linking NAD binding (GO:0070403) to S phase of mitotic cell cycle (GO:0000084) and DNA replication factor C complex (GO:0005663). 	0.0011470688590285555	0.0002493086049752282	0.9986036225359963
PMC5845707	SRP133150	Methods	ENA	False	Creation	The NGS TRG-TRD data set has been submitted to the BioProject repository (BioProjectID: PRJNA434217, submissionID SUB3660187; http://www.ncbi.nlm.nih.gov/bioproject/434217). 	Sequencing details can be accessed through SRA database accession SRP133150 (https://www.ncbi.nlm.nih.gov/sra/SRP133150). 	nan	8.527643665400695e-07	0.9998392761991057	0.00015987103652767332
PMC3325407	rs1800414	Abstract	RefSNP	False	Use	Long-range haplotype tests provide evidence of selection for the blue-eye allele at the three haplotyped systems but not for the green/hazel eye SNP allele. 	We also saw evidence of selection at the derived allele of rs1800414 in East Asia. 	Our data suggest that the haplotype restricted to Europe is the strongest marker for blue eyes globally and add further inferential evidence that the derived allele of rs1800414 is an East Asian skin pigmentation allele. 	2.6851666900260496e-07	3.310520716450628e-13	0.9999997314829999
PMC5231271	phs000092	Acknowledgments	dbGaP	False	Use	nan	We acknowledge the Study of Addiction: Genetics and Environment (SAGE), which is part of the Gene Environment Association Studies (GENEVA) initiative supported by the National Human Genome Research Institute (dbGaP study accession phs000092.v1.p1). 	nan	0.00703393313515573	1.0611063777350597e-06	0.9929650057584665
PMC5966898	GSE98815	Acknowledgments	GEO	False	Creation	Unless otherwise specified, all genomics analyses were performed in R and code for these analyses is available from https://sourceforge.net/projects/scc25timecourse. 	All transcriptional and epigenetic data of the cell lines from this paper have been deposited in GEO (GSE98815). 	DNA methylation data of head and neck tumors after treatment with cetuximab are available in GEO (GSE110996). 	0.00020889358485331913	0.536408568477569	0.46338253793757767
PMC4551926	GM12878	Results	IGSR/1000 Genomes	True	Use	Structural characteristics and biological functions of TADs. 	(A) Structures and functions of two TADs from chromatin region (Chr1:180,470,000-181,145,000) in cell line GM12878-I at 5 kb resolution. 	The two-dimensional interaction heat map, epigenomic signals, RNA expression, DNA repeats and reference genes are shown. Arrow indicates the boundary position between two TADs. 	1.122765608808279e-25	1.2768951286777583e-12	0.999999999998723
PMC3943257	KC414026	Figure	ENA	True	Use	The y-axis gives the percentage of identity within a sliding window 80 bp wide centered on the position plotted, with a step size between plots of 50 bp. 	Map of CAV variant (accession no: KC414026) and the recombination breakpoints (beginning breakpoint at 2,100 and ending breakpoint at 158) in alignment with the CAV variant DNA nucleotide sequence. 	(a) Phylogenetic analysis of 37 CAV isolates in different species based on the genomic sequence. The three analyzed sequences (AF311900, JQ690762, and CAV variant) are indicated in red. 	1.765025938016547e-27	1.894892051857873e-13	0.9999999999998106
PMC4030988	2P06	Results	PDBe	True	Use	nan	3D structures and ADMs of 1R8J (a) and (b), 1XL3(c) and (d), 2FM9 (e) and (f), 2NP5 (g) and (h), and 2P06 (i) and (j). 	A portion in light gray denotes the corresponding E-to-H helix part. The label “5–34” denotes the compact region predicted by ADM. 	1.8555170367872696e-27	1.0974809217358575e-12	0.9999999999989024
PMC3325407	rs1800414	Results	RefSNP	False	Use	Here we see the derived allele of rs1800414 occurs on three haplotypes, though a vast majority occurs on a single haplotype (CACCACT). 	Of the remaining two haplotypes containing the derived allele of rs1800414, one differs from the most common haplotype at the last site and the other differs at the final four sites.Fig. 7Haplotypes containing the derived allele of rs1800414 in East Asians. 	This figure shows a seven-SNP haplotype in the “light skin” region of OCA2 in East Asians. The seven SNPs were chosen based on the first region of high LD in East Asians from Fig. 4. 	1.0488394208996007e-09	2.975841908229008e-11	0.9999999989214021
PMC3466181	1VA4	Results	PDBe	False	Use	FClip1 is a new member of lipase V family. 	In order to obtain its structural information, the modeled structure of FClip1 was constructed by using Phyre 2 Protein Fold Recognition Server with the aryl esterase PFE from Pseudomonas fluorescens (PDB code: 1VA4) as a template (see Table S1, Figure S1 and S2A for the details). 	Phyre 2 uses the alignment of hidden Markov models and incorporates ab initio folding simulation. This significantly improves modeling accuracy that could routinely create the accurate models at very low sequence identity (15–25%) [16]. 	3.9260458184400767e-07	1.828630229325326e-09	0.9999996055667878
PMC5840367	rs10455872	Results	RefSNP	False	Use	The joint analysis showed a robust association between AS and rs7543130 (OR = 1.20; 95% CI: 1.16–1.25; P = 1.2 × 10−22) as well as rs1830321 (EAF[T] = 37.5%) intronic to TEX41, a non-protein coding gene on chromosome 2q22 (OR = 1.15; 95% CI: 1.11–1.20, P = 1.8 × 10−13) (Table 1). 	We replicated the reported association of the intronic LPA variant6 rs10455872 with AS in Iceland and the follow-up sample sets (combined OR = 1.46; 95% CI: 1.37–1.56, P = 1.9 × 10−31) (Table 1). 	In contrast, we did not find association with variants implicating osteogenic and calcium signaling pathway genes, previously reported to suggestively associate with AS16 (P > 0.05 in Iceland and UK Biobank). We tested the association of the two novel AS variants and the LPA variant with a subset of Icelandic AS cases who had undergone aortic valve replacement, representing those with severe AS. 	5.310793515213019e-10	2.864943240154494e-12	0.9999999994660558
PMC5660696	KX352089	Methods	ENA	False	Creation	16S rRNA gene and transcript sequences obtained in this study are deposited under GenBank accession numbers MF320555 to MF320732. 	Sequences of pufM genes and transcripts are deposited under GenBank accession numbers KX352089 to KX352145 and KX358536 to KX358562, respectively. 	nan	1.2657857204959257e-14	0.9999999999999776	9.730577714582182e-15
PMC4030988	2P06	Results	PDBe	False	Use	Hypothetical Protein AF0060 (2P06) 	The 3D structure and ADM of the hypothetical protein AF0060 (2P06) are presented in Figure 6i and 6j. 	The ADM predicts the almost whole region to be the compact region (3–83) as seen in Table 2. The Dali search hit portions corresponding to the G-H helices and a small portion of the corresponding E helix as the part with a 3D structure similar to the query structure (Figure S1 in Supplementary Material). 	0.0004231593148493819	2.0838493652980693e-07	0.9995766323002141
PMC3325407	rs1800407	Introduction	RefSNP	False	Use	The populations are divided by regional group on the x-axis as follows: Africa (yellow), Southwest Asia (green), Europe (blue), Central Asia (orange), Pacific Islands (purple), East Asia (red), and Native Americans (teal) 	Geographic distribution of the derived allele of rs1800407 	The derived allele of rs1800407 is relatively rare compared to the blue-eye associated alleles of the three BEHs. The derived allele frequencies of rs1800407 are presented in Fig. 3. 	0.0524889229331136	6.205889210282915e-09	0.9475110708609972
PMC4555083	EF027134	Methods	ENA	False	Use	CHIKV purification and inactivation by β-Propiolactone (BPL) 	The CHIKV strain (accession number EF027134) used in the current study was obtained from the virus repository of the National Institute of Virology, Pune, India. 	Following incubation in the Vero E6 cell line, CHIKV was harvested when cells exhibited 80−90% cytopathic effect. The clarified supernatant was removed, lysed cell pellets were centrifuged, and the supernatant was pooled with the culture supernatant. 	1.3149621398300382e-05	0.0013693894699194436	0.9986174609086824
PMC3697978	E-MEXP-1594	Methods	ArrayExpress	False	Use	nan	We downloaded gene expression profiles and measures of competitive fitness of 40 wild-derived lines of Drosophila melanogaster from ArrayExpress (accession E-MEXP-1594) and the Drosophila Genetic Reference Panel (DGRP) website (http://dgrp.gnets.ncsu.edu/) (Ayroles et al. 2009). 	A line’s competitive fitness (Knight and Robertson 1957; Hartl and Jungen 1979) measures the percentage of offspring bearing the assay line’s genotype recovered from vials seeded with a known proportion of adults from a reference line. We used the BSFG model to infer a set of latent factor traits underlying the among-line gene expression covariance matrix for a subset of the genes and the among-line covariance between each gene and competitive fitness. 	2.2675956119320922e-05	1.2965062227794325e-07	0.9999771943932583
PMC4263733	CAC35979	Figure	ENA	True	Use	Alignment of the residues from the binding pocket region through the third transmembrane region of several ligand-gated ion channels. 	The alignment contains the sequences from four invertebrate glutamate-gated chloride channels (GluClCryst and GluClα2b from C. Elegans and GluClAc1 and GluClAc2 from Aplysia californica), and those from two vertebrate receptors: the glycine receptor Glyα1 from Rattus norvegicus (accession #CAC35979 ) and the GABA receptor from Homo sapiens, GABAA-ρ1 (accession #EAW48558). 	The second line represents the secondary structure of GluClCryst: the blue arrows represent β-sheets; the orange tubes, the α-helices. Loop C and helices M1, M2 and M3 are indicated above the alignment. 	1.0547987389124045e-27	3.427130828994422e-15	0.9999999999999967
PMC5122352	rs2853677	Results	RefSNP	False	Use	These data indicate that Snail1 can bind to the enhancer and repress TERT transcription by inhibiting enhancer activity. 	The C allele of rs2853677 disrupts the association of Snail1 and prevents TERT downregulation in response to Snail1 upregulation. 	The well-known function of Snail1 is to promote the epithelial-mesenchymal transition (EMT), a process that is critical for cancer malignancy and metastasis. We accessed The Cancer Genome Atlas (TCGA) public database to analyze any correlation among Snail1, TERT and E-cadherin (an important cell-cell adherent junction protein whose downregulation is a golden mark of the EMT) in lung adenocarcinoma. 	6.070845653201376e-06	1.311270657895896e-07	0.999993798027281
PMC4437040	AY243496	Article	ENA	False	Use	The datafile associated to this figure is an NCBI PopSet with accession ID 32329588 containing an alignment of a fully annotated ciliate gene (accession AF194338.1) against several partially sequenced allelic variants. 	One of the variants with accession ID AY243496.1 appears to be partly non-functionalized. 	First to see this data, we view it in the pager less (press “q” to quit and “space” to page): A key feature of the Unix shell allows users to recall previous commands in their so-called history, usually by typing the “up-arrow,” for possble re-use and editing. 	0.00037348881587939616	0.00042813147688945213	0.9991983797072312
PMC5501546	rs2075650	Conclusion	RefSNP	False	Background	In the present study, a common CAD-associated variant at the TOMM40/APOE locus (rs2075650) was significantly associated with lower levels of hs-CRP in patients with stable CAD. 	Future studies using deep sequencing of the TOMM40/APOE locus in large clinical samples are warranted to determine if rs2075650 is truly causing opposite allelic effects on CAD and hs-CRP, or if the opposite association is explained by underlying linkage disequilibrium with several hidden functional variants of which some affect the development of CAD independent of hs-CRP. 	None of the remaining variants, both assessed independently or combined as a GRS, were associated with hs-CRP, IL-6, calprotectin, fibrinogen, or C3. Our findings may suggest that the effect of these CAD-loci on CAD development does not act through pathways significantly affecting these commonly used inflammatory biomarkers. 	0.9534476831400063	0.00019344808928818208	0.04635886877070551
PMC4016241	304800	Methods	OMIM	False	Background	Goh et al. [6] have categorized the 3200 disease phenotypes in OMIM database into 22 disease groups/classes, i.e. Cancer, Metabolic, Neurological, Endocrine, etc, based on the physiological system affected. 	For example, the Endocrine disease group comprises 62 OMIM phenotypes, including OMIM 241850 (Bamforth-Lazarus syndrome) and OMIM 304800 (Diabetes insipidus, nephrogenic) etc. 	Phenotype similarity network Disease phenotype similarity network [24], is defined as GPH = (VPH, EPH), where VPH denotes the set of disease phenotypes and EPH denotes relevant phenotype pairs. 	0.9842453401604909	0.00016043483449292007	0.01559422500501619
PMC6278402	AF121904	Results	ENA	False	Use	Generally, pectate lyases are classified into PL families 1, 2, 3, 9, and 10 according to the CAZy database [19]. 	The amino acid sequence of PpPel10a from P. polymyxa KF-1 showed similarity to the characterized PL family 10 pectate lyases (e.g., AF121904.1, 35%; JQ723690, 40%) (Figure 2). 	Using the family 10 polysaccharide lyase from Cellvibrio cellulosa (PDB ID: 1GXN, identity = 44.79%) as a template [27], the structure of PpPel10a was modelled; it displayed a predominantly α-helical structure with short β-strands and irregular coils (Figure S2). The structure of family 10 pectate lyases is different from that of the pectate lyases from PL families 1, 3 and 9, which have a parallel β-helix fold [28]. 	0.011055764759615457	2.6395080904741523e-06	0.9889415957322941
PMC4030988	1XL3	Results	PDBe	False	Use	Secretion Control Protein (1XL3) 	This protein consists of only α helices. Figure 6c and 6d present the 3D structure and ADM of the secretion control protein (1XL3). 	The predicted compact regions are 3–44, 77–99 and 124–201 and the corresponding E-to-H helices are included in the last predicted region with the highest η value (see Figure 6d and Table 2). The DALI search picked up the corresponding E, G and H helix parts in this protein, as the parts are structurally similar to the query structure. 	0.0008261254618936343	4.170980787977436e-07	0.9991734574400275
PMC3720590	AEI90145	Introduction	ENA	False	Use	Our lab has reported that a surface-located α-enolase is an adhesion-related protein in M. bovis Hubei-1 [18]. 	Here, we analyzed the entire M. bovis Hubei-1 genome [20], and we identified the gene vpmaX (GenBank: AEI90145.1) that encodes a protein named “variable surface lipoprotein A” (VpmaX) according to GenBank. 	However, it is absolutely different from the VspA protein in PG45 (GenBank: ADR25410.1). Our report aims to characterize Hubei-1 vpmaX and the adhesion ability of its encoded protein. 	6.53435694567217e-05	6.129685069075836e-09	0.9999346503008582
PMC4682451	138120	Methods	OMIM	False	Use	M.CviPI enzyme methylates accessible DNA at GpC sites, whereas nucleosome-bound DNA is inaccessible and remains refractory to GpC methylation. 	The promoter of the HSPA5 (MIM #138120) gene, known to be nucleosome free and accessible, was used as a control for GpC methyltransferase M.CviPl in each sample examined. 	GpCpG sites were excluded from analysis. Nucleosome occupancy was defined as a region ≥150 bp that was inaccessible to M.CviPI. 	0.08572377888363228	4.528126321975143e-05	0.914230939853148
PMC6447580	2F61	Results	PDBe	False	Use	This mutation at 409 changes D to V (Valine), a non-polar amino acid side chain, which lost all WT interactions with surrounding amino acid side chains. 	Human PDB crystal structures 2F61, pH7.2, 2.5 Å and 3GXI, pH 5.5, 1.84 Å from Swiss PDB Viewer (DeepView, SPDBV,Version 4.10) program were used for modelling. 	Amino acids involved side chain interaction are listed in Supplementary Table 1. V394 is located on Domain 1 of GCase at the anti-parallel β-sheet, which is close to the active site pocket (a loop formation) opening13,30. 	1.1844674996003376e-06	3.189802720675033e-08	0.9999987836344731
PMC3206007	2Y01	Discussion	PDBe	False	Use	Recently, the crystal structure of turkey β1-AR in complex with different agonists and antagonists was published [37]. 	In this work, the authors showed the presence of structural differences between the 2ECL of the β1-AR bound to the agonist dobutamine (PDB 2Y01) and to the antagonist cyanopindolol (PDB2VT4). 	A 1 Å contraction of the ligand-binding pocket between helices H5 and H7 was observed in the agonist complex relative to the antagonist complex. The contraction of the catecholamine-binding pocket induced a conformational change in the 2ECL [37]. 	0.03838322315167165	6.757533555536103e-07	0.9616161010949728
