PMCID	AccessionNb	Section	SubType	Figure	Categories	PreCitation	Citation	PostCitation	Background	Creation	Use
PMC5663151	SRR3737019	Methods	ENA	False	Use	(University of Udine, Italy) using an Illumina (Solexa) HiSeq2500. 	The genome sequences determined are available in GenBank, accession numbers: B. cenocepacia D4 (SRR3736982), B. cenocepacia D4/C18 (SRR3737008), B. cenocepacia D4/C20 (SRR3737019). 	nan	0.001305148391716168	0.40050380272432357	0.5981910488839604
PMC3743022	E-MTAB-1654	Article	ArrayExpress	False	Creation	K.K. conceived the study, identified the surface markers, generated D6s4B5 iPSC line, analysed RNA-sequencing data, supervised experiment design and data interpretation, and wrote the manuscript. 	Author Information RNA-sequencing data are deposited in the ArrayExpress under accession number E-MTAB-1654. 	Reprints and permissions information is available online at www.nature.com/reprints. The authors declare no competing financial interests. 	4.610759675130087e-08	0.9997378235914882	0.00026213030091495226
PMC4392464	PRJNA242298	Results	BioProject	False	Creation	There were 133 and 50,008 contigs longer than 10,000 and 1,000 bp, respectively (Table 1). 	All assembled sequences were deposited in NCBI’s Transcriptome Shotgun Assembly (TSA) database (http://www.ncbi.nlm.nih.gov/genbank/tsa/) under the accession number PRJNA242298. 	Of the 140,432 contigs, 91,303 (65.0%) had annotation information (Additional file 1: Table S1). For contigs with lengths ≥1,000 bp, 94.7% had BLASTX hits. 	1.873897461070789e-09	0.9999628050613772	3.719306472540044e-05
PMC4228564	607093	Introduction	OMIM	False	Background	Increased homocysteine and decreased methionine cause decreased SAM to S-adenosylhomocysteine ratio, which takes part in DNA methylation.[4] 	The MTHFR gene (OMIM 607093) has been mapped at short arm of chromosome 1 (1p36.3) and more than 40 polymorphism have been described in MTHFR, but C677T (rs1801133) is the most common[5] in which a cytosine is replaced by thymine at 677th position (alanine →valine in protein). 	C677T mutation was shown to render the enzyme thermolabile and homozygotes (T/T) and heterozygotes (C/T) had about a 70% and 35% reduced MTHFR enzymatic activity. Frequency of mutant T allele differs in various ethnic and geographical populations of the world. 	0.9999823271271662	8.225218981741049e-07	1.6850350935757833e-05
PMC5797170	PRJEB23243	Methods	BioProject	False	Creation	nan	Sequencing datasets can be accessed as BAM files (.bam) from the European Nucleotide Archive under accession number PRJEB23243. 	nan	0.0007383027558875291	0.8351741263279804	0.1640875709161321
PMC5215406	HPA028275	Results	HPA	False	Use	For correlation plots between repeated experiments, see Figure S3. 	Antibody targeting with HPA030562 and HPA028275 for CDH5 and FABP1, respectively, was confirmed with Western blot of serum samples from the SAFE‐T DILI cohort, a recombinant CDH5 standard and FABP1 overexpression lysate. 	Bands at the predicted molecular mass were detected (Fig. 	0.0011222588268654994	3.5923995384854197e-06	0.998874148773596
PMC5667448	1XNK	Methods	PDBe	False	Use	The molecular replacement, structure model building, refinement, and validation were performed using PHASER [89], PHENIX [90], Coot [91], and MolProbity program [92]. 	PDB ID 1XNK was used as template. 	PyMOL (the PyMOL Molecular Graphics System, Version 1.8 Schrödinger, LLC) was used for structure representations. 	0.0008853466173319883	6.420828803734845e-06	0.9991082325538643
PMC3494444	120436	Methods	OMIM	False	Use	The DNA fragments encompassing four exons and adjacent intronic sequences of MGMT (OMIM 156569) gene were PCR amplified and directly sequenced using BigDye Terminator v1.1 Cycle Sequencing Kit (Applied Biosystems, Foster City, CA, USA) and the ABI PRISM 3100 genetic analyser. 	For DAOY, D341Med, D283Med, and 1580WÜ, the genomic DNA regions covering 19 exons of MLH1 (OMIM 120436; GenBank accession number NM_0000249) were also PCR amplified and sequenced as described recently (Buerki et al, 2012). 	MLH1 promoter hypermethylation analysis The promoter methylation status of MLH1 in DAOY, D341Med, D283Med, and 1580WÜ cells was evaluated using the SALSA ME011-B1 MS-MLPA (methylation-specific, multiplex-ligation-dependent probe amplification) MMR Probemix Kit (MRC Holland, Amsterdam, The Netherlands) (Buerki et al, 2012). 	4.6723564993574895e-05	0.000505645486936224	0.9994476309480702
PMC5041910	GSE8401	Results	GEO	True	Use	(A) GEO analysis to deduce candidate genes that regulate the distinctive signaling of TD cells. 	Three independent GSE studies including colon cancer cell (GSE2509), melanoma (GSE8401) and pancreatic cancer cell after TGFβ exposure (GSE23952) were used to select out common metastasis-regulating genes. 	Gene Ontology (GO) with ‘adhesion’ and ‘signaling’ was applied to narrow down candidate genes (left) and the gene information is shown in right table. Red and black indicate upregulated or downregulated, respectively. 	7.31508420534071e-26	1.0740305074146573e-11	0.9999999999892597
PMC5923093	PRJNA398137	Methods	BioProject	False	Creation	nan	The accession numbers for all the M. abscessus isolates sequenced in this study are available at DDBJ/ENA/GenBank under BioProject PRJNA398137. 	nan	2.5595892520930834e-07	0.9988411070508882	0.0011586369901867503
PMC3497266	EU591532	Methods	ENA	False	Use	5′- and 3′-RACE were carried out with the SMART RACE cDNA amplification kit (Clontech, USA) employing gene-specific primers inferred from the PCR fragments (Table 2). 	The full-length sequences of BplCesAs were submitted to GenBank with the accession numbers EU591529, EU591530, EU591531 and EU591532. 	nan	2.8514775348631704e-06	0.4701444929178552	0.5298526556046098
PMC5591096	rs3765467	Discussion	RefSNP	False	Use	Meanwhile, the degree of DPP-4 inhibitor efficacy could be explained by ethnicity.[33] Compared to non-Asians, Asians exhibit a higher capacity to respond to DPP-4 inhibitor treatment. 	In a meta-analysis study, lower BMI in Asians, which could be related to insulin sensitivity, was referred to as a primary factor.[33] According to an international database, minor allele frequency (MAF) for rs3765467 is reported to occur in up to 36% of Asians, which is relatively high compared to other ethnicities.[34] In the current study, the MAF was 17.1%. 	The relatively high A allele frequency in Asians may account for the better response in these populations. A recent Taiwanese study showed that GLP-1 analog response was not affected by GLP1R variation.[35] The study enrolled 36 patients with poorly controlled hyperglycemia and treated them with a 6-day continuous subcutaneous insulin infusion and exenatide, a GLP-1 analogue. 	0.3524678242535082	1.1785548363962844e-07	0.6475320578910081
PMC5358358	4EHQ	Results	PDBe	True	Use	Calmodulin-binding modes. 	(A) Cartoon representation of ligand-bound calcium-loaded calmodulin in canonical (PDB ID code 1CDM; complex with calmodulin-dependent protein kinase II) and alternative (PDB ID code 4EHQ; complex with Orai1) binding modes, with calmodulin in gold and the original ligands in blue. 	An extra Orai1 helix (green) was modeled into the N-lobe–binding packet to demonstrate the bivalent interaction capability of the alternative binding mode. Calcium ions are shown as red spheres. 	1.4004926136017978e-27	2.973955872087268e-13	0.9999999999997027
PMC3757061	1TND	Methods	PDBe	False	Use	MD simulations: The structural models 	The following PDB structures were selected as inputs of MD simulations: GαGTP WT (PDB code: 1TND [19], residue range 27–342), which is the GTP-bound form of Gα, and the GαGTP-RGS-PDEγWT ternary complex (PDB code: 1FQJ [16]) involving GαGTP (amino acids from 28 to 344), RGS (i.e. the RGS domain of RGS9, amino acids 286 to 418) and the 42-amino acid C-terminal fragment of PDEγ (residues 46–87). 	Input structure setup required a number of modifications in the original crystal structures. As for 1TND, the original GTPγS analogue was replaced by GTP, as recently reported [20]. 	0.001032915508966367	2.677671902059104e-07	0.9989668167238434
PMC5751318	1FZB	Figure	PDBe	True	Use	Exposed hydrophobic region in the unpolymerized fibrinogen gamma chain as a potential site for abnormal interactions with APOB. 	A fibrinogen γ monomer (PDB 1FZB) is shown together with the homology model of APOB with bound lipids [13] and the crystal structure of the closest structurally characterized homologue of the latter, lipovitellin (PDB 1LSH). 	Molecular surfaces are colored according to the residue hydrophobicity. The partial lipid structures bound to lipovitellin are present in the crystal structure. 	5.8874263130534e-24	3.225432541003858e-14	0.9999999999999678
PMC6068308	GU053649	Results	ENA	False	Use	One faecal FCoV from cat 37 had a longer intact 3c gene of 720 bases. 	This sequence was genetically closest (96.3%) in a BLAST search to two intact 3c gene sequences of FIPV strains DSKUU48 (GU053649) [5] and UU9 [6]. 	Ascites and pleural effusion samples containing FCoVs were taken from 32 cats in animal hospitals. Two ascites samples contained type II FCoVs with truncating mutations in the ORF of 3c. 	0.17057185882282644	6.861413424141293e-06	0.8294212797637495
PMC3145266	ABO15549	Article	ENA	False	Use	This loss is likely due do the complete loss of the GLO gene because BLAST searches cannot identify GLO gene sequences in any of the completely sequenced teleost fish genomes [28]. 	These negative results are likely significant because BLAST searches using a chicken GLO protein sequence (GenBank accession number XP_001234314) as a query readily finds numerous GLO protein sequences, including that of the sturgeon species Acipenser transmontanus (GenBank accession number ABO15549, which is 74% identical to that of chicken) and even that of the tunicate Ciona intestinalis (GenBank accession number XP_ 002122023, which is 48% identical to that of chicken). 	Given the high degree of conservation of this gene, the fact that GLO orthologues cannot be identified from the currently available teleost genomes is likely the result of the fact that this non-functional gene has mutated beyond recognition or that it has been deleted from teleost genomes altogether. Furthermore, the gene coding for gulonolactonase, the penultimate enzyme in vitamin C synthesis (Fig. 1), is readily identified in BLAST searches using the human protein as a query (GenBank accession number EAL24133) in teleost genomes such as that of the zebra fish Danio rerio (GenBank accession number AAI52248), the salmon Salmo salar (GenBank accession number ACI69713) and the European flounder Platichthys flesus (GenBank accession number ACI69713), among others. 	0.10284167064825113	0.0035449333745006632	0.8936133959772482
PMC5592930	U87145	Results	ENA	False	Use	The MaSuRCA scaffolds jcf7180006226006 and jcf7180006136291 were independently assembled updates to contig 108821 (AWGU01108821) and contig 45101 (AWGU01045101) in the first-generation bobwhite assembly, and are included in File S2. 	Scaffold jcf7180006136291 produced a blastn alignment with 76% identity to the Toxoplasma gondii apicoplast complete genome (accession U87145.2) across 99% of the scaffold (8761 bp), and could represent a portion of an apicoplast sequence. 	Scaffold jcf7180006226006 produced a blastn alignment with 72% identity to Sarcocystis neurona (strain SN3, clone E1, contig 00498) whole genome shotgun sequence (accession: JAQE01000498.1) across 37% of the scaffold length (357,155 bp). The query coverage of 37% is the result of 731 high scoring segment pairs (HSPs), the longest of which covers 5870 bp of the scaffold sequence (1.6%). 	0.01091041006289151	0.00025794641790578664	0.9888316435192026
PMC5539595	KY709203	Results	ENA	False	Use	Further sub-classification led to 10 different subtypes of which the most frequently observed types were A20G1 (n = 22/ KY709197), A17G1 (n = 3; samples Qa342, Qa530, and Qa577/ Acc.num: KY709201), and A18G1 (n = 2; samples Qa522 and Qa 558/Acc.num: KY709200). 	A unique isolate was identified for each of the following sub-type: A19G2 (sample Qa574/Acc.num: KY709198), A18G2 (sample Qa58/Acc.num: KY709199), A16G1 (sample Qa249/Acc.num: KY709202), and A14G1 (sample Qa482/Acc.num: KY709203). 	The C. hominis subtype family identified among the four isolates was Ib. Within this subtype family, only two subtypes were identified with subtype IbA9G3 being the most common, present in three cases (samples Qa468, Qa471, and Qa479/Acc.num: KY709204, and KY709205) and subtype IbA10G2 identified in just one case (sample Qa208/Acc.num: KY709206). 	4.854339374180199e-06	8.120641589604441e-10	0.9999951448485617
PMC4338595	3JWD	Figure	PDBe	True	Use	Contacts with CD4 (yellow) and Fabs (green) are shown as transparent surfaces (modeled relative to the gp120 core from PDB: 1GC1) 24. 	The regions unresolved in the trimer structure are shown as dashed lines. D) The effects of 17b binding to sCD4-bound SOSIP.664 trimers are similarly mapped onto the CD4-bound conformation of gp120, as modeled into the trimer structure (PDB: 3JWD) 70. 	The change within HR2 in the ternary complex is not shown, as this region is not resolved in the trimer structure. The plots for selected peptides derived from (A) KNH1144 and (B) BG505 SOSIP.664 trimers in unliganded trimer or in complex with sCD4 or various antibodies, as stated. 	4.117702405763251e-27	3.545778721035956e-16	0.9999999999999996
PMC5471064	rs1401492	Article	RefSNP	False	Use	In 2011, based on the HyperGen study, a GWAS including 1,040 African Americans explored the association between insulin resistance and genetic variation. 	The results showed SNPs linked with homeostasis model assessment of insulin resistance (HOMA-IR) and fasting insulin near ATP10A (rs6576507 and rs8026527) and CACNA1D (rs1401492) [54]. 	Obesity is related with insulin resistance, and also a strong risk factor for T2DM. Thus, we can assume reasonably that some loci of obesity would also be insulin resistance loci, or possibly T2DM susceptibility loci. 	0.0016898113041333132	7.054134735404011e-07	0.998309483282393
PMC4293902	2F5Z	Discussion	PDBe	False	Use	This limitation notwithstanding, the AUC and SAXS data are all consistent with a dimeric structure for PfaE3 and are not inconsistent with the augmented homology model. 	In addition to the two extra loops, the high-resolution model positions a two-stranded anti-parallel β motif in the space that, in the structure of human E3 plus the SBD of E3BP (PDB ID: 2F5Z, [33]), is occupied by the E3BP SBD. PfaE3 does not interact with E3BP SBD, but rather the SBD of PfE2 since the parasite genome does not encode an e3bp homologue. 	The presence of this ‘extra’ β motif implies that this interaction may be quite different from that observed for human E3-E3BP, supporting the suitability of PfaE3 as a target for the development of intervention strategies. To further assess PfaE3 function, we generated Pfae3 null mutants (3D7Δae3). 	0.00024781015759056923	1.0626356699307309e-08	0.9997521792160527
PMC5595876	AJ507799	Methods	ENA	False	Use	Identification of EBV infection in PTCL using RNA-seq 	Sequences were mapped against the EBV genome (AJ507799.2) using Burrows-Wheeler Aligner (v0.7.5)23 and analyzed with SAMtools (v0.6.1)24. 	Samples with 100 or more EBV-derived reads were classified as EBV-positive (Supplementary Figure S2). 	1.2006421272226313e-07	3.046703968724907e-06	0.9999968332318185
PMC6097609	HPA027250	Methods	HPA	False	Use	For 3D-SIM in human U-2 OS cell, cells were fixed in ice-cold methanol, washed with PBST and blocked in PBST containing 10%FCS for 30 min. 	The following primary antibodies were used diluted in PBST containing 10%FCS: rabbit anti-Gorab (1:200, Atlas, #HPA027250, specificity also tested in this study, fig. 	S6f,g), rabbit anti-Pericentrin (1:200, Abcam,#ab4448, directly labeled with Alexa594), mouse monoclonal anti-Sas6 (1:100, Santa-Cruz Biotechnology, #sc-81431). An OMX-V3 system was used with a 63x/1.4NA oil Olympus lens to acquire super-resolution images (512x512ppi). 	0.0029418954083030202	0.001503559596263635	0.9955545449954334
PMC3497266	AY372246	Methods	ENA	False	Use	The cDNA was used as a template for amplification in 50 μL PCR buffer (TaKaRa, China). 	Two upstream (U1 and U2) and two downstream (D1 and D2) degenerate primers (Table 2) were designed with Primer Premier 5.0 software based on conserved motif sequences of eight CESAs mRNAs from other plants [Populus tremuloides CesA2 (AY095297), Populus trichocarpa CesA6-E (Pti806784), Eucalyptus grandis CesA3 (DQ014507), Arabidopsis thaliana CesA3 (At5g05170), Bambusa oldhamii CesA5 (DQ020213), Pinus taeda CesA3 (AY789652), Pinus radiata CesA1 (AY639654), Zea mays CesA12 (AY372246)]. 	PCR products were separated by agarose gel electrophoresis, and amplified products (approximately 2000-bp) were isolated and ligated into the pGEM-T easy vector (Promega, USA). 5′- and 3′-RACE were carried out with the SMART RACE cDNA amplification kit (Clontech, USA) employing gene-specific primers inferred from the PCR fragments (Table 2). 	2.866921076311255e-07	1.1380931629158122e-08	0.9999997019269606
PMC3310866	2FJG	Results	PDBe	True	Use	Structure-dependent determinants for the amino acid preferences Wji. 	(a) The interface structure of the antibody-VEGF depicted in this panel is attained from the G6-Fab-VEGF complex structure (2FJG). 	The 30 CDR interface residues are shown in stick model, and the VEGF homodimer structure (V and W chains) is shown in sphere model, where some of the residues are labeled according to the numbering in 2FJG. The CDR interface residues are color-coded based on the Wji-Xji correlation coefficients, for which data for the correlation computation are listed in Table S4. 	1.8582321197221395e-22	1.0472652365026507e-10	0.9999999998952736
PMC6029241	1IGT	Figure	PDBe	True	Use	nan	Functionalization of IONPs Schematic representation to scale of IONPs and the structure of different molecules used for their functionalization Structures represented: IONPs doxorubicin RGD peptide (PDB ID: 3VI4) chlorotoxin (PDB ID: 1CHL) azurin p28 peptide (PDB ID: 4AZU) Nucant (N6L) [52] aptamer (PDB ID 4HQU) and antibody (PDB ID: 1IGT). 	nan	1.501496641165441e-30	3.674951820651212e-20	1.0
PMC5671994	GCA_000020705.1	Methods	GCA	False	Use	The library was prepared using the PacBio’s 20 Kb template prep protocol (PN_100-286-000-06) and it was size-selected by using a range setting of 8,000 bp to 50,000 bp. De Novo assembly was performed using PacBio native pipeline (27). 	Comparative genomic analysis was independently performed with MAUVE v.20150225 (28) and Mummer v.3.23 (29) programs, using the annotated genome of SH strain SL476 as reference (GenBank assembly accession: GCA_000020705.1) (30). 	The shared genomic fragments between UFPR1 and SL476 were identified with Mummer while the regions with no match between them were identified with a Perl script (available in https://github.com/CaioFreire/Scripts). PROKKA v.1.12 software was used for genome annotation (31) and the circular map was drawn using DNAPlotter v.10.2 (32). 	3.172514658671676e-06	3.990233362037392e-05	0.999956925151721
PMC4591669	JU090722	Results	ENA	False	Use	Notable contigs in cluster NG1-QT39 further included two putative transcription factors (an AP2 family member, Pa_00973 and an MYB family member, Pa_23194, best B2G hit MYB66), a putative (hemi)cellulase (Pa_10720) and a lipid transport protein (Pa_22556, best BG2 hit uncharacterized GPI-anchored protein). 	The best PAVE hit of the latter contig was another assembled sweet cherry cDNA encoding a putative lipid transport protein, PaLTPG1 (GenBank JU090722), tentatively involved in cuticle deposition in sweet cherry fruit.29 Other exocarp-specific, putatively cuticle-related contigs in cluster NG1-QT39 included Pa_14044 and Pa_04572. 	nan	0.002719396270484231	2.229798769273467e-05	0.997258305741823
PMC3794727	1LDS	Figure	PDBe	True	Use	nan	The native structure of wild-type (WT) human beta-2 microglobulin (Hβ2m) (PDB ID: 1LDS) and its primary sequence. 	The location of each β-strand along the protein sequence is also shown. In the single-point mutants, the secondary structure assignment is identical. 	4.4178114979479795e-27	7.653068109125496e-16	0.9999999999999993
PMC5750462	1AA7	Figure	PDBe	True	Use	(D) Comparison of monomer structures of wild-type (wt) 1EA3 (gray, neutral), M(NLS-88R)-acidic (blue), M(NLS-88E)-acidic (red) and M(NLS-88E)-neutral (yellow). 	(E) Comparison of dimer structures of wt 1AA7 (gray, acidic), M(NLS-88R)-acidic (blue), M(NLS-88E)-acidic (red) and M(NLS-88E)-neutral (yellow). 	(F) Comparison of the two symmetry-related dimer interfaces of M(NLS-88R)-acidic (gray) and M(NLS-88E)-neutral (yellow). Stereo-view of electron density map and final dimer model of residue 88 environment in M(NLS-88R)-acidic and M(NLS-88E)-neutral. 	4.621379321779646e-28	1.4168267865166457e-17	1.0
PMC4253824	2AFC	Methods	PDBe	False	Use	At the end of the experiment, participants were reimbursed (according to their final balance) and answered a written question about possible strategies during the task. 	In a semi-structured verbal interview, participants were asked about their own hypotheses regarding the experiment, the origin of color changes (self-induced or physical changes on the computer screen), any association with reward/punishment delivery, possible associations between this delivery and color of the stimulus, as well as a 2-alternative forced choice (2AFC) question regarding color and reward/punishment (red or blue). 	nan	4.457022350657733e-05	1.0452930190333238e-05	0.9999449768463031
PMC3797761	ACO57702	Supplementary material	ENA	False	Use	nan	Phylogenetic tree of epithiospecifier modifier 1 (ESM1) co-factor associated with glucosinolate hydrolysis based on the amino acid sequences deduced from the isolated cDNA sequences. Brassica oleracea consensus (cabbage, broccoli, and cauliflower), Brassica rapa ssp. perkinesis (ACO57702.1), Brassica napus (ACO57703.1), and Arabidopsis thaliana ESM1 (ABB90255.1) used to construct phylogenetic tree. 	The values in parenthesis are amino acid sequence similarity with B. oleracea consensus by using NCBI BLAST search. The tree was constructed using Clustal W2 (http://www.ebi.ac.uk/Tools/clustalw2/). 	1.101426440307207e-05	2.2111640611808983e-09	0.9999889835244329
PMC6208079	KY365435	Methods	ENA	False	Creation	The data supporting the conclusions of this article are included within the article. 	Representative sequences were submitted to the GenBank database under the accession numbers KY365435-KY365437. 	Voucher specimens are available in the collection of the Museum of Parasitology, Department of Parasitology and Parasitic Diseases, University of Agricultural Sciences and Veterinary Medicine Cluj-Napoca, Romania under accession numbers CJ005077, CJ005086. The dataset and reference materials are available from the corresponding author upon request. 	3.5559654192074546e-09	0.9999997734956112	2.229484234971167e-07
PMC5869493	1UCU	Figure	PDBe	True	Use	Domain structure of full-length flagellin. 	Image derived from PDB ID: 1UCU [38] visualized with iCn3D (https://www.ncbi.nlm.nih.gov/Structure/icn3d/full.html) and modified to indicate D0, D1, D2 and D3 domains. 	Residues 89–96 (QRVRELAV) in the D1 domain are encircled by a red dashed line. FliC constructs expressed in a mammalian system are secreted and maintain Toll-like receptor 5 (TLR5) agonist activity. 	1.3476203098729783e-23	6.074486701473584e-15	0.999999999999994
PMC2132710	AF044312	Figure	ENA	True	Use	m4.1G and m4.1R sequences diverge at the NH2 termini and in regions separating the defined domains. 	Whereas there is increased m4.1R sequence between the MBD and SABD, the region between the SABD and CTD is expanded in m4.1G. m4.1G sequence data is available from EMBL/GenBank/DDBJ accession number AF044312. 	Specificity of the FKBP13/4.1G–CTD interaction. (A) FKBP13 and 4.1G– CTD double transformants were grown on plates containing 0, 1, 10, and 50 μM FK506. 	6.802550127520496e-24	4.511917939297172e-09	0.999999995488082
PMC5490736	PRJNA318571	Methods	BioProject	False	Use	Genomes with curated metadata are available through the Integrated Microbial Genome (IMG) database78 (analysis project GOLD IDs are summarized in Supplementary Table 2). 	Genomes were also submitted to NCBI in BioProjects PRJNA318571-3. 	Transcriptome reads that mapped to the Cycloclasticus symbionts were deposited in the European Nucleotide Archive under the accession number PRJEB12576. SAG assembly statistics and annotations are available through the Integrated Microbial Genome (IMG) database under IMG taxon IDs 2599185276, 2599185294, 2599185283, 2602042074, 2599185280, and 2599185270. 	0.00016001326185575765	0.4496022482373912	0.5502377385007531
PMC6171930	U46016	Results	ENA	True	Creation	Patients who developed HIV-1 drug resistance (black circles for HIV-1 proviral DNA and black rectangles for HIV-1 RNA) also indicated. 	For comparison, 17 reference strains (empty circles) from the Los Alamos HIV-1 database representing subtype C with GenBank accession numbers U46016 (Ethiopia C), AF067155 (India C), AF110980 (Botswana C), AF361874 (Tanzania C), AY772699 (S Africa C), U52953 (Brazil C), AF286233 (Israel C), AF286230 (China C), AF286225 (Zambia C), and A,B,D,F,G,H,J,K subtypes are included. 	The nucleotide sequences were submitted to GenBank (accession number: KJ807732—KJ807772 and KJ807649—KJ807689 for proviral DNA and viral RNA, respectively). 	1.5302856444074672e-23	0.9501459306512311	0.049854069348768855
