PMC5012869	3EKR	Methods	PDBe	False	Use	All the structures were energetically minimized using Tripos force field and Gasteiger-Hückel charges. 	The structures of ATPase domain of topo II and Hsp90 were retrieved from RCSB Protein Data Bank (PDB entry code: 1ZXM and 3EKR) (Wei et al., 2005; Kung et al., 2008). 	The ligands were extracted and water molecules were removed from the initial x-ray crystal structure. The docking was carried out for both of the topo II and Hsp90 inhibitors to topo II and Hsp90 using Surflex-Dock (Jain, 2003). 
PMC5045647	KX247448	Methods	ENA	False	Use	Amplification and sequencing of standard mitochondrial gene cytochrome c oxidase subunit I (COI) 	As described previously [32], primers Bc1 Culic Fm and JerR2m were used to PCR amplify a 692 bp segment of the COI gene from 76 C. brevitarsis individuals with accession numbers [GenBank: KX247448-KX247523]. 	A total of four previously identified and published haplotypes was added with the following accession numbers: [GenBank: KJ162968, KJ162967, KJ162975 and KJ162957]. These sequences included one of C. asiatica, the most closely related species to C. brevitarsis [7]. 
PMC5045647	KX247523	Methods	ENA	False	Use	Amplification and sequencing of standard mitochondrial gene cytochrome c oxidase subunit I (COI) 	As described previously [32], primers Bc1 Culic Fm and JerR2m were used to PCR amplify a 692 bp segment of the COI gene from 76 C. brevitarsis individuals with accession numbers [GenBank: KX247448-KX247523]. 	A total of four previously identified and published haplotypes was added with the following accession numbers: [GenBank: KJ162968, KJ162967, KJ162975 and KJ162957]. These sequences included one of C. asiatica, the most closely related species to C. brevitarsis [7]. 
PMC5045647	KJ162968	Methods	ENA	False	Use	As described previously [32], primers Bc1 Culic Fm and JerR2m were used to PCR amplify a 692 bp segment of the COI gene from 76 C. brevitarsis individuals with accession numbers [GenBank: KX247448-KX247523]. 	A total of four previously identified and published haplotypes was added with the following accession numbers: [GenBank: KJ162968, KJ162967, KJ162975 and KJ162957]. 	These sequences included one of C. asiatica, the most closely related species to C. brevitarsis [7]. The PCR amplicons were purified using QIAquick PCR purification kit (Qiagen) and 20 μl was sequenced using the Sanger sequencing method (Macrogen, Geumchun-gu, Seoul). 
PMC5045647	KJ162967	Methods	ENA	False	Use	As described previously [32], primers Bc1 Culic Fm and JerR2m were used to PCR amplify a 692 bp segment of the COI gene from 76 C. brevitarsis individuals with accession numbers [GenBank: KX247448-KX247523]. 	A total of four previously identified and published haplotypes was added with the following accession numbers: [GenBank: KJ162968, KJ162967, KJ162975 and KJ162957]. 	These sequences included one of C. asiatica, the most closely related species to C. brevitarsis [7]. The PCR amplicons were purified using QIAquick PCR purification kit (Qiagen) and 20 μl was sequenced using the Sanger sequencing method (Macrogen, Geumchun-gu, Seoul). 
PMC5045647	KJ162975	Methods	ENA	False	Use	As described previously [32], primers Bc1 Culic Fm and JerR2m were used to PCR amplify a 692 bp segment of the COI gene from 76 C. brevitarsis individuals with accession numbers [GenBank: KX247448-KX247523]. 	A total of four previously identified and published haplotypes was added with the following accession numbers: [GenBank: KJ162968, KJ162967, KJ162975 and KJ162957]. 	These sequences included one of C. asiatica, the most closely related species to C. brevitarsis [7]. The PCR amplicons were purified using QIAquick PCR purification kit (Qiagen) and 20 μl was sequenced using the Sanger sequencing method (Macrogen, Geumchun-gu, Seoul). 
PMC5045647	KJ162957	Methods	ENA	False	Use	As described previously [32], primers Bc1 Culic Fm and JerR2m were used to PCR amplify a 692 bp segment of the COI gene from 76 C. brevitarsis individuals with accession numbers [GenBank: KX247448-KX247523]. 	A total of four previously identified and published haplotypes was added with the following accession numbers: [GenBank: KJ162968, KJ162967, KJ162975 and KJ162957]. 	These sequences included one of C. asiatica, the most closely related species to C. brevitarsis [7]. The PCR amplicons were purified using QIAquick PCR purification kit (Qiagen) and 20 μl was sequenced using the Sanger sequencing method (Macrogen, Geumchun-gu, Seoul). 
PMC5061766	AY237122	Methods	ENA	False	Use	For the construction of the pNWVT vector, the spoVT gene (BC0059) including its own promoter was amplified from B. cereus ATCC 14579 chromosomal DNA using primers AKupVT-F and TIFN16. 	The resulting product was cut with EcoRI and KpnI (Fermentas, FastDigest) and ligated into the corresponding sites of pNW33n (Genbank Accession number, AY237122), which resulted in pNWVT. 	The pVTBsu2 vector was created by replacing spoVTBCE with spoVTBSU in pNWVT, which was amplified using primers BsuVTF2 and BsuVTR. The primers were specifically designed to ensure that spoVTBSU expression would be driven by the B. cereus spoVT promoter already present in pNWVT. 
PMC5069455	3ox2	Results	PDBe	False	Use	Relative expressional levels of GA‐related genes in wild‐type and PtCYP714A3 transgenic plants. WT, wild type; Z33 and Z38, independent transgenic lines. 	The name and the accession numbers of the genes are as the following: CPS1, ent‐copalyl diphosphate synthase (AP004572); KS1, ent‐kaurene synthase (OSJN00255); KO2, eht‐kaurene oxidase (AP005471); KAO, ent‐kaurenoic acid oxidase (AP000616); GA20ox2, GA 20‐oxidase (AB077025); GA3ox2, GA 3‐oxidase (AB056519); GA2ox3, GA 2‐oxidase (NM_001050827); GID1, soluble GA receptor (AB211399); GID2, F‐box protein (AB100246). 	Values are means ± SD of three biological replicates from the WT or the transgenic lines. Significant differences were analysed with Student's t‐test. *, P < 0.05; **, 0.05 < P < 0.01; ***, 0.01 < P < 0.001. 
PMC5069455	2ox3	Results	PDBe	False	Use	Relative expressional levels of GA‐related genes in wild‐type and PtCYP714A3 transgenic plants. WT, wild type; Z33 and Z38, independent transgenic lines. 	The name and the accession numbers of the genes are as the following: CPS1, ent‐copalyl diphosphate synthase (AP004572); KS1, ent‐kaurene synthase (OSJN00255); KO2, eht‐kaurene oxidase (AP005471); KAO, ent‐kaurenoic acid oxidase (AP000616); GA20ox2, GA 20‐oxidase (AB077025); GA3ox2, GA 3‐oxidase (AB056519); GA2ox3, GA 2‐oxidase (NM_001050827); GID1, soluble GA receptor (AB211399); GID2, F‐box protein (AB100246). 	Values are means ± SD of three biological replicates from the WT or the transgenic lines. Significant differences were analysed with Student's t‐test. *, P < 0.05; **, 0.05 < P < 0.01; ***, 0.01 < P < 0.001. 
PMC5116274	RRID:SCR_002285	Methods	RRID	False	Use	Larvae were imaged between 5–7 dpf, or at 14 dpf, using the following confocal microscopes: Zeiss LSM 510 (SO and SR data, 40x/0.8NA objective), Leica SP8 in photon counting mode (IO data, 20x/1.0NA objective), Zeiss LSM 710 (IR/MR data, 40x/1.1NA objective), and Zeiss LSM 800 (Kaede data, 40x/1.0NA objective). 	Image analysis was performed using ImageJ (Fiji) (Schindelin et al., 2012; RRID:SCR_002285) and cell location recorded on vector templates using Illustrator CC 2014 (Adobe Systems, San Jose, CA; RRID:SCR_010279). 	To identify particular somata as motoneurons associated with a given extraocular muscle, we used two criteria: first, the projection patterns of extraocular motoneurons (Fig. 1C, D), which are highly conserved across vertebrates (Evinger, 1988); and second, the known lack of GFP expression in IO motoneurons in the Tg(isl1:GFP) background (Higashijima et al., 2000). Somata filled contralaterally to the right eye (left side of the brain) were defined as SO motoneurons if found in nIV, or SR motoneurons if found in nIII (Fig. 2A). 
PMC5116274	RRID:SCR_010279	Methods	RRID	False	Use	Larvae were imaged between 5–7 dpf, or at 14 dpf, using the following confocal microscopes: Zeiss LSM 510 (SO and SR data, 40x/0.8NA objective), Leica SP8 in photon counting mode (IO data, 20x/1.0NA objective), Zeiss LSM 710 (IR/MR data, 40x/1.1NA objective), and Zeiss LSM 800 (Kaede data, 40x/1.0NA objective). 	Image analysis was performed using ImageJ (Fiji) (Schindelin et al., 2012; RRID:SCR_002285) and cell location recorded on vector templates using Illustrator CC 2014 (Adobe Systems, San Jose, CA; RRID:SCR_010279). 	To identify particular somata as motoneurons associated with a given extraocular muscle, we used two criteria: first, the projection patterns of extraocular motoneurons (Fig. 1C, D), which are highly conserved across vertebrates (Evinger, 1988); and second, the known lack of GFP expression in IO motoneurons in the Tg(isl1:GFP) background (Higashijima et al., 2000). Somata filled contralaterally to the right eye (left side of the brain) were defined as SO motoneurons if found in nIV, or SR motoneurons if found in nIII (Fig. 2A). 
PMC5129875	Q9QNF7	Results	UniProt	False	Use	To investigate whether minority sequences with mutations had occurred within the tumor, we also subcloned two of the PCR amplicons and sequenced individual subclones. 	No mutation was observed in subclones of amplicon 5; in contrast, in two of the sublclones of amplicon 3, there was a single point mutation (Figure 7c) not located at critical sites of the TK enzyme (ATP and nucleotide-binding sites)17 (http://www.uniprot.org/uniprot/Q9QNF7). 	Transplantation of TK-NPC produced mature neurons which were not sensitive to ganciclovir treatment The in vivo results, shown so far, were obtained with transplantation of undifferentiated pluripotent stem cells. 
PMC5134065	2014-001321-32	Abstract	EUDRACT	False	Unclassifiable		EudraCTno.: 2014-001321-32. 	
PMC5154150	NCT01753050	Abstract	NCT	False	ClinicalTrials	During this time frame, no patients were treated with additional monitoring that could measure intraoperative stroke volume. 	The study protocol was registered at ClinicalTrials.gov (NCT01753050) and approved by the ethics committee at Charité – Universitätsmedizin Berlin (EA1/315/12). 	Informed written consent was obtained from all prospective GDFT patients. Retrospective patients (control group) provided their consent to use their data in anonymized fashion for scientific purposes by signing the treatment contract with our university hospital. 
PMC5156332	AAO49840	Introduction	ENA	False		[Note that in NC_001629.1 (Schouler et al., 1994); bIL67 genes ORF34–35–36 are annotated as gp04–03–02. 	For ease of clarity we will refer to the gene products using their respective ORF gene numbers.] gpl15 (NP_043563) is a minor structural protein, while hypothetical protein gp35 (AAO49840) is proposed to be a host-determinant protein (Stuer-Lauridsen et al., 2003). 	gpl15/gp35 show conservation at the N termini and to a lesser degree the C-terminal ends while the middle is variable and likely to be involved in host recognition. It has been shown that recombinant bIL67 isolates which maintained the 5′ and 3′ ends of gene ORF35 but exchanged the middle section for that of phage CHL92 ORF2 acquired the host range of CHL92. 
PMC5156332	AAD20610	Introduction	ENA	False		Adsorption patterns of these hybrid bIL67 isolates were equivalent to those of CHL92 (Stuer-Lauridsen et al., 2003). 	Lastly, gpl16 (NP_043564) is a minor structural protein while hypothetical protein gp36 (NP_042309) is possibly a collar protein (AAD20610). 	In the infection process, lactococcal phages including C2viruses initially recognize carbohydrate receptors to bind to the host cell wall (for recent reviews see Ainsworth et al., 2014; Chapot-Chartier, 2014; Mahony et al., 2016; McCabe et al., 2015). More extensive studies have been performed on carbohydrate receptors of the 936 and P335 type phages while studies of C2viruses have focused on a cell membrane protein secondary receptor designated Pip (phage infection protein) (Valyasevi et al., 1991; Monteville et al., 1994). 
PMC5156332	L14679	Introduction	ENA	False		For phage c2, binding to carbohydrate receptors is reversible, and interaction with Pip results in irreversible binding followed by phage DNA ejection (Monteville et al., 1994; Geller et al., 1993). 	The lactococcal Pip protein, first described in L. lactis C2 (GenBank accession number L14679), is a 901 aa membrane-spanning protein encoded by a 2706-bp gene (Geller et al., 1993) with homologues in most Gram-positive bacteria (Mooney et al., 2006); notably Bacillus subtilis orthologue yueB (São-José et al., 2004, 2006). 	It has been reported that inactivation of pip virtually eliminates infection by C2virus in lactococci without any apparent effect on the host (Garbutt et al., 1997; Kraus & Geller, 1998). Similarly, SPP1 requires YueB to infect B. subtilis, where the interaction has been extensively studied (Plisson et al., 2007; Jakuytė et al., 2012). 
PMC5156332	AAD20610	Results	ENA	False		HHpred analyses of gpl14/gp34 from all phages in this study result in top domain hit 5E7T (5e7t_B); minor structural protein 5; bacteriophages; Lactococcus lactis. Minor structural protein 5 is identified as ORF 52/BppA in lactococcal phage TUC2009 (accession number NC_002703), a component of the tripod baseplate structure with a putative carbohydrate binding domain and involved in receptor binding (McGrath et al., 2006, Legrand et al., 2016). 	gpl16/gp36 are classified as minor structural/hypothetical proteins (NP_043564/NP_042309), possibly collar proteins as a gene with 76 % identity to ORF36 was found in addition to l16 in a phage c2 isolate exhibiting a prominent collar structure at its head–tail interface (accession number AAD20610). 	HHpred analyses of gpl16/gp36 from all phages in this study likewise identified carbohydrate binding domains with top hits to 1GU3 and 1GU1. McGrath et al. (2006) showed that the saccharide binding site of Tuc2009 Bpp A is more similar to 1GU1 in structural comparisons. gpl15/gp35 is a minor structural protein proposed to be involved in phage adsorption to the host (NP_043563/ AAO49840) (Stuer-Lauridsen et al., 2003). 
PMC5156332	1GU3	Results	PDBe	False		gpl16/gp36 are classified as minor structural/hypothetical proteins (NP_043564/NP_042309), possibly collar proteins as a gene with 76 % identity to ORF36 was found in addition to l16 in a phage c2 isolate exhibiting a prominent collar structure at its head–tail interface (accession number AAD20610). 	HHpred analyses of gpl16/gp36 from all phages in this study likewise identified carbohydrate binding domains with top hits to 1GU3 and 1GU1. McGrath et al. (2006) showed that the saccharide binding site of Tuc2009 Bpp A is more similar to 1GU1 in structural comparisons. 	gpl15/gp35 is a minor structural protein proposed to be involved in phage adsorption to the host (NP_043563/ AAO49840) (Stuer-Lauridsen et al., 2003). As with gpl14/gp34, HHpred analyses of all phages, except M6162, gave a top domain hit to 5E7T (5e7t_B). 
PMC5156332	1GU1	Results	PDBe	False		gpl16/gp36 are classified as minor structural/hypothetical proteins (NP_043564/NP_042309), possibly collar proteins as a gene with 76 % identity to ORF36 was found in addition to l16 in a phage c2 isolate exhibiting a prominent collar structure at its head–tail interface (accession number AAD20610). 	HHpred analyses of gpl16/gp36 from all phages in this study likewise identified carbohydrate binding domains with top hits to 1GU3 and 1GU1. McGrath et al. (2006) showed that the saccharide binding site of Tuc2009 Bpp A is more similar to 1GU1 in structural comparisons. 	gpl15/gp35 is a minor structural protein proposed to be involved in phage adsorption to the host (NP_043563/ AAO49840) (Stuer-Lauridsen et al., 2003). As with gpl14/gp34, HHpred analyses of all phages, except M6162, gave a top domain hit to 5E7T (5e7t_B). 
PMC5156332	AAO49840	Results	ENA	False		HHpred analyses of gpl16/gp36 from all phages in this study likewise identified carbohydrate binding domains with top hits to 1GU3 and 1GU1. McGrath et al. (2006) showed that the saccharide binding site of Tuc2009 Bpp A is more similar to 1GU1 in structural comparisons. 	gpl15/gp35 is a minor structural protein proposed to be involved in phage adsorption to the host (NP_043563/ AAO49840) (Stuer-Lauridsen et al., 2003). 	As with gpl14/gp34, HHpred analyses of all phages, except M6162, gave a top domain hit to 5E7T (5e7t_B). It has been previously reported that the N termini of gpl15/gp35 are conserved, the C termini less conserved, and the middle region variable and probably responsible for host recognition (Stuer- Lauridsen et al., 2003). 
PMC5156332	3CNI	Results	PDBe	False		Similar to C2viruses, phage SPP1 first binds reversibly to carbohydrate moieties, specifically the cell-wall teichoic acids, then, as a precursor to phage DNA ejection, irreversibly to B. subtilis YueB (Plisson et al., 2007; Vinga et al., 2012). 	Note that as YjaE and Pip are structurally similar (HHpred analysis identified domains 3CNI and 2CH7 in both), the same inference can be extended to both proteins. 	Structural studies identified SPP1 tail spike protein gp21, specifically its C terminus, binding to YueB (São-José et al., 2004, 2006). The N erminus of SPP1 gp21 shares 26 % amino acid identity to the N terminus of lactococcal phage tail proteins, Tal2009 (Tuc2009 ORF53) and Tal901-1 (TP901-1 ORF47) (Plisson et al., 2007; Stockdale et al., 2013). 
PMC5156332	2CH7	Results	PDBe	False		Similar to C2viruses, phage SPP1 first binds reversibly to carbohydrate moieties, specifically the cell-wall teichoic acids, then, as a precursor to phage DNA ejection, irreversibly to B. subtilis YueB (Plisson et al., 2007; Vinga et al., 2012). 	Note that as YjaE and Pip are structurally similar (HHpred analysis identified domains 3CNI and 2CH7 in both), the same inference can be extended to both proteins. 	Structural studies identified SPP1 tail spike protein gp21, specifically its C terminus, binding to YueB (São-José et al., 2004, 2006). The N erminus of SPP1 gp21 shares 26 % amino acid identity to the N terminus of lactococcal phage tail proteins, Tal2009 (Tuc2009 ORF53) and Tal901-1 (TP901-1 ORF47) (Plisson et al., 2007; Stockdale et al., 2013). 
PMC5215406	HPA028275	Results	HPA	False		For correlation plots between repeated experiments, see Figure S3. 	Antibody targeting with HPA030562 and HPA028275 for CDH5 and FABP1, respectively, was confirmed with Western blot of serum samples from the SAFE‐T DILI cohort, a recombinant CDH5 standard and FABP1 overexpression lysate. 	Bands at the predicted molecular mass were detected (Fig. 
PMC5216611	168600	Introduction	OMIM	False			Genetics plays a significant role in PD [MIM*168600], both in determining risk (if one will develop PD: cause) as well as age-at-onset (when a disease might manifest: modifier) (1). 	Several rare causative genes (2–11) and 28 common risk alleles (12–16) have been confirmed for PD. The known genes and risk factors account for ∼5% of the heritability (17), hence much of the genetic component of PD is still missing. 
PMC5216611	609718	Discussion	OMIM	False		The loci accounted for 3.5% (5q14.1) and 3.9% (15q22.2) of variation in age-at-onset. 	The 5q14.1 signal maps to LHFPL2 [MIM*609718], a member of the lipoma HMGIC fusion partner (LHFP) gene family. 	The function of LHFPL2 is unknown. Interestingly, LHFPL2 is expressed in all normal tissues and cell lines except brain and leukocytes (40); however, while healthy brain tissue has no detectable LHFPL2 transcript, LHFPL2 protein is abundant in malignant brain tissue (41). 
PMC5216611	191010	Discussion	OMIM	False		Interestingly, LHFPL2 is expressed in all normal tissues and cell lines except brain and leukocytes (40); however, while healthy brain tissue has no detectable LHFPL2 transcript, LHFPL2 protein is abundant in malignant brain tissue (41). 	The 15q22.2 signal maps to the tropomyosin 1 gene (TPM1 [MIM*191010]). TPM1 encodes a highly conserved actin-binding protein that plays a central role in calcium-dependent regulation of muscle contraction. TPM1 is a tumour suppressor gene (42). 	Cancer and Parkinson’s disease are often likened to the two sides of a coin. Epidemiological studies have shown that the risk of developing PD is inversely associated with the risk of developing cancer (except skin cancer) (43). 
PMC5219038	1GZX	Article	PDBe	False		In the process, a hydroperoxide (OOH–) complex is formed. 	Images were produced using UCSF Chimera [202] and crystal structures from the Protein Data Bank: human hemoglobin tetramer 1GZX (α2β2, ~64 kDa), arthropod hemocyanin subunit 1OXY (~72 kDa), mollusc hemocyanin functional unit 1JS8 (~50 kDa) and sipunculid hemerythrin homo-octamer 1I4Y (~108 kDa). Inset oxygen is coloured grey; iron is coloured red; copper is coloured orange; histidines are coloured blue: aspartic acid is pink and glutamic acid is green  	Extracellular Hbs (or erythrocruorins) are mostly large, oligomeric proteins with molecular masses up to 3.6 MDa. Vinogradov (1985) classified them into four separate groups: (a) single-domain, single-subunit Hbs (~16 kDa) found in trematodes and some insects, (b) two-domain, multi-subunit Hbs in branchiopod crustaceans such as Daphnia and Triops, (c) multi-domain, multi-subunit Hbs in carapace-free brachiopod crustaceans, the planorbid snails and some clams (~1.7 MDa) and (d) single-domain, multi-subunit Hb aggregates ca. 3.6 MDa in annelids [14]. 
PMC5219038	1OXY	Article	PDBe	False		In the process, a hydroperoxide (OOH–) complex is formed. 	Images were produced using UCSF Chimera [202] and crystal structures from the Protein Data Bank: human hemoglobin tetramer 1GZX (α2β2, ~64 kDa), arthropod hemocyanin subunit 1OXY (~72 kDa), mollusc hemocyanin functional unit 1JS8 (~50 kDa) and sipunculid hemerythrin homo-octamer 1I4Y (~108 kDa). Inset oxygen is coloured grey; iron is coloured red; copper is coloured orange; histidines are coloured blue: aspartic acid is pink and glutamic acid is green  	Extracellular Hbs (or erythrocruorins) are mostly large, oligomeric proteins with molecular masses up to 3.6 MDa. Vinogradov (1985) classified them into four separate groups: (a) single-domain, single-subunit Hbs (~16 kDa) found in trematodes and some insects, (b) two-domain, multi-subunit Hbs in branchiopod crustaceans such as Daphnia and Triops, (c) multi-domain, multi-subunit Hbs in carapace-free brachiopod crustaceans, the planorbid snails and some clams (~1.7 MDa) and (d) single-domain, multi-subunit Hb aggregates ca. 3.6 MDa in annelids [14]. 
PMC5219038	1JS8	Article	PDBe	False		In the process, a hydroperoxide (OOH–) complex is formed. 	Images were produced using UCSF Chimera [202] and crystal structures from the Protein Data Bank: human hemoglobin tetramer 1GZX (α2β2, ~64 kDa), arthropod hemocyanin subunit 1OXY (~72 kDa), mollusc hemocyanin functional unit 1JS8 (~50 kDa) and sipunculid hemerythrin homo-octamer 1I4Y (~108 kDa). Inset oxygen is coloured grey; iron is coloured red; copper is coloured orange; histidines are coloured blue: aspartic acid is pink and glutamic acid is green  	Extracellular Hbs (or erythrocruorins) are mostly large, oligomeric proteins with molecular masses up to 3.6 MDa. Vinogradov (1985) classified them into four separate groups: (a) single-domain, single-subunit Hbs (~16 kDa) found in trematodes and some insects, (b) two-domain, multi-subunit Hbs in branchiopod crustaceans such as Daphnia and Triops, (c) multi-domain, multi-subunit Hbs in carapace-free brachiopod crustaceans, the planorbid snails and some clams (~1.7 MDa) and (d) single-domain, multi-subunit Hb aggregates ca. 3.6 MDa in annelids [14]. 
PMC5219038	1I4Y	Article	PDBe	False		In the process, a hydroperoxide (OOH–) complex is formed. 	Images were produced using UCSF Chimera [202] and crystal structures from the Protein Data Bank: human hemoglobin tetramer 1GZX (α2β2, ~64 kDa), arthropod hemocyanin subunit 1OXY (~72 kDa), mollusc hemocyanin functional unit 1JS8 (~50 kDa) and sipunculid hemerythrin homo-octamer 1I4Y (~108 kDa). Inset oxygen is coloured grey; iron is coloured red; copper is coloured orange; histidines are coloured blue: aspartic acid is pink and glutamic acid is green  	Extracellular Hbs (or erythrocruorins) are mostly large, oligomeric proteins with molecular masses up to 3.6 MDa. Vinogradov (1985) classified them into four separate groups: (a) single-domain, single-subunit Hbs (~16 kDa) found in trematodes and some insects, (b) two-domain, multi-subunit Hbs in branchiopod crustaceans such as Daphnia and Triops, (c) multi-domain, multi-subunit Hbs in carapace-free brachiopod crustaceans, the planorbid snails and some clams (~1.7 MDa) and (d) single-domain, multi-subunit Hb aggregates ca. 3.6 MDa in annelids [14]. 
PMC5219038	1GZX	Article	PDBe	False			The protoporphyrin ring is coloured black. B Secondary structural features of the oxy-hemoglobin tetramer (PDB 1GZX) are presented as ribbons. 	Alpha and beta chains are coloured light yellow and grey, respectively. Coils are coloured black. 
