PMC2862243	216900	Introduction	OMIM	False	Background		Achromatopsia (ACHM; OMIM 216900) is a congenital autosomal recessive cone disorder with a prevalence of 1 in 30,000 individuals [1]. 	The clinical features include low visual acuity, nystagmus, photophobia, severe color vision defects, and no recordable or only residual cone function on electroretinography (ERG) with normal rod functions. Fundoscopy is usually normal, although macular pigmentary changes and atrophy have been described in the literature [2-5]. 
PMC3884852	1SR3	Article	PDBe	False	Background	CcmE is a heme-binding protein, discovered as an essential System I component as early as the late 1990's [63]. 	CcmE is a monotopic membrane protein, anchored to the membrane via its N-terminal TM segment and exposing its active site to the periplasm; it is the only Ccm component of the heme trafficking and delivery module of System I for which a three-dimensional structure is available ([21] PDB: 1SR3; [64] PDB: 1LM0). 	The 3D structure of the apo-state (without bound heme) consists of a six-stranded antiparallel β-sheet, reminiscent of the classical OB-fold [65] with N- and C-terminal extensions. CcmE can be considered a “heme chaperone,” as it protects the cell from a potentially dangerous compound by sequestering free heme in the periplasm [66]; it is thought to act as an intermediate in the heme delivery pathway of Cytc maturation. 
PMC3884852	1LM0	Article	PDBe	False	Background	CcmE is a heme-binding protein, discovered as an essential System I component as early as the late 1990's [63]. 	CcmE is a monotopic membrane protein, anchored to the membrane via its N-terminal TM segment and exposing its active site to the periplasm; it is the only Ccm component of the heme trafficking and delivery module of System I for which a three-dimensional structure is available ([21] PDB: 1SR3; [64] PDB: 1LM0). 	The 3D structure of the apo-state (without bound heme) consists of a six-stranded antiparallel β-sheet, reminiscent of the classical OB-fold [65] with N- and C-terminal extensions. CcmE can be considered a “heme chaperone,” as it protects the cell from a potentially dangerous compound by sequestering free heme in the periplasm [66]; it is thought to act as an intermediate in the heme delivery pathway of Cytc maturation. 
PMC5686652	2011-003010-17	Methods	EUDRACT	False	Background		Data on hepatic fat fraction (%) and abdominal SAT and VAT area (cm2), obtained by MRI (1.5-T magnet; Magnetom Avanto, Siemens Medical Systems, Erlangen, Germany), were available for 67 patients with type 2 diabetes enrolled for the Eudract 2011-003010-17 study, as described elsewhere [22]. 	
PMCID	AccessionNb	Section	SubType	Figure	Categories	Pre-citation	Citation	Post-citation
PMC3210356	NCT01217008	Article	NCT	False	ClinicalTrials	Indeed, this has been recognized by the U.S. 	Food and Drug Administration (FDA) in allowing a clinical trial of embryonic stem cell-derived cells in SCI to proceed on the basis of pre-clinical safety demonstrated exclusively in rodent models (www.clinicaltrial.gov; clinical trial identifier: NCT01217008). 	Moreover, it is important to note that rodent contusion/compression models of SCI are generally “incomplete” with partial sparing of motor and sensory functions. These models closely mimic most patients with severe, partial lesions with an American Spinal Injury Association (ASIA) impairment (ASI) scale rating of AIS B or C. Given that most trials of cell therapy have been carried out in AIS A patients (the safest to inject, but also the least likely to show cell therapy-induced benefit), there is a need for future clinical trials to include patients actually modeled in the laboratory. 
PMC3210356	NCT01231893	Article	NCT	False	ClinicalTrials	Current Clinical Trials of Cell Therapy for SCI 	There are currently more than a dozen recently completed, ongoing, or recruiting cell therapy clinical trials for SCI listed on clinicaltrials.gov [26], of which 2 do not involve stem cells per se (a phase I trial of OECs in thoracic AIS A subjects [clinical trial identifier: NCT01231893], and a phase II trial of activated macrophages in cervical and thoracic SCI [clinical trial identifier: NCT00073853], subsequently suspended due to financial constraints experienced by the sponsor). 	Most trials are phase I or I/II clinical safety and feasibility studies, indicating that cellular treatments for SCI developed in the laboratory are still in the very early stages of clinical translation. These trials build on the development of micro-neurosurgical techniques and image-guided approaches that facilitate the safe targeting of the injured CNS with cell-based approaches. 
PMC3210356	NCT00073853	Article	NCT	False	ClinicalTrials	Current Clinical Trials of Cell Therapy for SCI 	There are currently more than a dozen recently completed, ongoing, or recruiting cell therapy clinical trials for SCI listed on clinicaltrials.gov [26], of which 2 do not involve stem cells per se (a phase I trial of OECs in thoracic AIS A subjects [clinical trial identifier: NCT01231893], and a phase II trial of activated macrophages in cervical and thoracic SCI [clinical trial identifier: NCT00073853], subsequently suspended due to financial constraints experienced by the sponsor). 	Most trials are phase I or I/II clinical safety and feasibility studies, indicating that cellular treatments for SCI developed in the laboratory are still in the very early stages of clinical translation. These trials build on the development of micro-neurosurgical techniques and image-guided approaches that facilitate the safe targeting of the injured CNS with cell-based approaches. 
PMC3210356	NCT01328860	Article	NCT	False	ClinicalTrials	The inflammatory component of SCI and subsequent demyelination of surviving axons are serious limiting factors in the efficacy of early cell therapy for SCI, as implanted cells are more likely to be eliminated by the host. 	It is therefore worth considering interventions to modify the inflammatory milieu to enhance donor cell survival and efficacy, as in the newly initiated clinical trial of autologous BMSCs in children suffering from SCI (Table 2) (clinical trial identifier: NCT01328860). 	On the other hand, and considering the 1 case of neoplasms in a recipient of fetal neural progenitor cells (NPCs) reported by Amariglio et al. [53], the question of whether this strategy may increase the oncogenic risk of cell therapy must be considered. 
PMC3210356	NCT01327768	Article	NCT	False	ClinicalTrials	At least 2 of these trials [60, 61] have reported functional improvement in small patient cohorts, which may be confirmed by future pre-clinical studies on human OECs of various anatomical derivations to support future clinical trials. 	The safe use of OECs in clinical trials for other conditions, such as ischemic stroke, further strengthens the case for their use in SCI (clinical trial identifier: NCT01327768). 	
PMC3210356	NCT01005004	Article	NCT	False	ClinicalTrials	Despite an origin of the fetal brain, they are regulated and often referred to as adult NPCs, because they are nonembryonic (stemcellsinc.com). 	These have been previously tested for the fatal infantile demyelination disorder Pelizaeus-Merzbacher disease (clinical trial identifier: NCT01005004) and neuronal ceroid lipofuscinosis (also referred to as Batten disease) (clinical trial identifier: NCT00337636). 	In the latter, they have recently been shown to persist without causing harm for as long as 2.5 years after implantation into immunosuppressed patients (http://www.internationaldrugdiscovery.com/ViewArticle.aspx?ContentID=2474). There is a lack of trials of NPCs in SCI, in spite of the bulk of pre-clinical findings to date in support of the potential of fetal and adult neural stem/progenitor cells (particularly the former) in experimental SCI models [23], which is likely to reflect ethical concerns as to their origins and practical issues hindering their isolation and directed differentiation. 
PMC3210356	NCT00337636	Article	NCT	False	ClinicalTrials	Despite an origin of the fetal brain, they are regulated and often referred to as adult NPCs, because they are nonembryonic (stemcellsinc.com). 	These have been previously tested for the fatal infantile demyelination disorder Pelizaeus-Merzbacher disease (clinical trial identifier: NCT01005004) and neuronal ceroid lipofuscinosis (also referred to as Batten disease) (clinical trial identifier: NCT00337636). 	In the latter, they have recently been shown to persist without causing harm for as long as 2.5 years after implantation into immunosuppressed patients (http://www.internationaldrugdiscovery.com/ViewArticle.aspx?ContentID=2474). There is a lack of trials of NPCs in SCI, in spite of the bulk of pre-clinical findings to date in support of the potential of fetal and adult neural stem/progenitor cells (particularly the former) in experimental SCI models [23], which is likely to reflect ethical concerns as to their origins and practical issues hindering their isolation and directed differentiation. 
PMC3210356	NCT01151124	Article	NCT	False	ClinicalTrials	The conditional immortalization of cells might provide a partial solution to limiting the use of fetal and embryonic tissue, overcoming the limited supply of cells irrespective of donor age, removing a source of variability between clinical trials and enabling extensive characterization of cell lines prior to clinical application. 	Clinically approved, conditionally immortalized fetal cortical NPCs (ReN001 or CTX0E03) of human origin are already in a phase I clinical trial for stroke in Scotland, UK (Pilot Investigation of Stem Cells in Stroke; clinical trial identifier: NCT01151124). 	These cells have been developed by the biotechnology firm ReNeuron using a karyotypically stable immortalization platform to enable cells to proliferate in culture and differentiate when induced without oncogenic transformation. Although this clinical trial will not include SCI patients, the results of this trial will be very interesting and relevant because stroke and SCI share many common pathophysiological mechanisms. 
PMC3654355	NCT01675713	Methods	NCT	False	ClinicalTrials	The Regional Committee for Medical and Health Research Ethics in Norway approved the protocol, and all the participants provided written informed consent. 	The study meets the standards of the Declaration of Helsinki and is registered in the ClinicalTrials.gov-registry under the unique trial number NCT01675713. 	
PMC3671266	NCT01770106	Introduction	NCT	False	ClinicalTrials	Indeed, this cytokine is multitasking, with roles ranging from bone remodeling to lymphoid tissue organization [10, 11]. 	Its importance has recently been highlighted by the development of a monoclonal antibody against RANKL (denosumab, Amgen Inc., Thousand Oaks, CA, USA) approved in the clinical practice for the treatment of postmenopausal osteoporosis and cancer-related osteolysis [12] and under evaluation in a Phase 4 clinical trial for rheumatoid arthritis (clinical trial identifier: NCT01770106). 	Here we summarize the many roles of RANKL in the bone and immune systems, review the clinical features of RANKL-deficient ARO patients, and discuss the results of preclinical studies on a RANKL-based pharmacological therapy holding great promise for these patients. 
PMC4171506	NCT01153932	Methods	NCT	False	ClinicalTrials	BMD biopsies were kindly provided by the Leiden University Medical Center (LUMC, Leiden, the Netherlands) and approved by the LUMC medical ethics committee and after written informed consent was obtained from all subjects or legal representatives. 	DMD biopsies were obtained from patients participating in clinical studies (registered at clinicaltrials.gov; NCT01153932 and NCT01037309) after approval by the local medical ethics committees and after signed patient informed consent including the assessment of dystrophin. 	Please see our supporting information file for a full list of participating sites (Table S1). 
PMC4171506	NCT01037309	Methods	NCT	False	ClinicalTrials	BMD biopsies were kindly provided by the Leiden University Medical Center (LUMC, Leiden, the Netherlands) and approved by the LUMC medical ethics committee and after written informed consent was obtained from all subjects or legal representatives. 	DMD biopsies were obtained from patients participating in clinical studies (registered at clinicaltrials.gov; NCT01153932 and NCT01037309) after approval by the local medical ethics committees and after signed patient informed consent including the assessment of dystrophin. 	Please see our supporting information file for a full list of participating sites (Table S1). 
PMC4171506	NCT01037309	Methods	NCT	False	ClinicalTrials	Samples DMD 1–3, 5, and 6 were naïve biopsies before treatment. 	DMD subject 5 participated in clinical study PRO044-CLIN-01 (Clinicaltrials.gov NCT01037309) and biopsies were taken before and after treatment with five weekly injections of 12 mg/kg antisense oligonucleotide PRO044, an investigational compound that can induce exon skipping to correct the reading frame of the mRNA. 	Muscle samples from control donors were obtained post-mortem from individuals not suffering from DMD and kindly provided by Prof. dr. 
PMC4246580	NCT01803568	Methods	NCT	False	ClinicalTrials	The study adhered to the Declaration of Helsinki and was approved by the National Regional Committee for Medical and Health Research Ethics North, Tromsø, Oslo, Norway. 	The study was registered with the US National Library of Medicine Clinical Trials registry (NCT01803568). 	Written informed consent was obtained from all participants prior to any study‐related procedure. Strength and endurance training intervention 
PMC4257525	NCT01859442	Abstract	NCT	False	ClinicalTrials		Clinicaltrials.gov registration NCT01859442 	
PMC4257525	NCT01325909	Methods	NCT	False	ClinicalTrials	Ethics approval for the main trial was given by the North West – Liverpool East Research and Ethics Committee (11/H1002/12) in March 2011, with a subsequent amendment (11/H1002/12c) adding 31P MRS measurements for this nested mechanism pilot sub-study approved in January 2012. 	The larger trial was registered with clinicaltrials.gov (NCT01325909 – March 2011), and initially this NCT registration was taken to cover all aspects of the larger trial, including the present pilot study. 	Subsequently the pilot study was registered separately (NCT 01859442 – May 2013), and as a result of this change of approach this specific registration post-dated the recruitment of the first patients reported here, for which studies commenced in October 2012. The authors confirm that all ongoing and related trials for this intervention are registered. 
PMC4376671	NCT00944281	Abstract	NCT	False	ClinicalTrials		ClinicalTrials.gov NCT00944281 	
PMC4376671	NCT00944281	Methods	NCT	False	ClinicalTrials	The study was registered as a clinical trial with the U.S. 	National Institutes of Health (NCT00944281;). 	Nine-month old infants were identified by periodic censuses in the study area. Written, informed consent was obtained from one of the child’s primary caregivers (mother, father or legal guardian). 
PMC4544847	NCT01742754	Abstract	NCT	False	ClinicalTrials		ClinicalTrials.gov NCT01742754 	
PMC4544847	NCT01742754	Methods	NCT	False	ClinicalTrials	Several modifications were made to the protocol prior to enrolling patients and the final protocol was approved October 2012.(S1 Protocol) At the time the study was initiated, fecal microbiota therapy did not fall into the category of a drug or biologic, and given that our primary aim was to evaluate engraftment rather than clinical outcomes, it was unclear whether registration with www.clinicaltrials.gov was necessary. 	Nonetheless, within 30 days of recruiting the first patient, the study was registered at www.clinicaltrials.gov (registration number NCT01742754). 	The authors confirm that all related trials for this intervention will be registered with www.clinicaltrials.gov. Written informed consent was obtained from all study subjects including both patients and stool donors. 
PMC4702357	NCT02360956	Abstract	NCT	False	ClinicalTrials		ClinicalTrials.gov: NCT02360956. 	
PMC4742391	NCT02031965	Discussion	NCT	False	ClinicalTrials	Attenuated oncolytic herpes viruses such as Seprehvir are promising therapeutic agents not only because they can safely and selectively destroy cancerous cells and release progeny virus to do likewise (the central paradigm of oncolytic virotherapy), but also because of their ability to stimulate an anti-tumor immune response. 	Two ongoing clinical trials are investigating the use of Seprehvir in young patients with either CNS (NCT02031965) or non-CNS (NCT00931931) solid tumors, the latter including patients with neuroblastoma. 	In this study we evaluated a panel of 12 human neuroblastoma cell lines for their expression of HSV entry mediators and assessed their responses to Seprehvir treatment. Most cells showed high expression of nectin-1 and 3-OS HS, two HSV entry receptors that have been shown to be important determinants of HSV susceptibility in various cell types (8, 9, 16, 17) Unexpectedly, we found that HSV receptor expression did not necessarily correlate with virus entry. 
PMC4742391	NCT00931931	Discussion	NCT	False	ClinicalTrials	Attenuated oncolytic herpes viruses such as Seprehvir are promising therapeutic agents not only because they can safely and selectively destroy cancerous cells and release progeny virus to do likewise (the central paradigm of oncolytic virotherapy), but also because of their ability to stimulate an anti-tumor immune response. 	Two ongoing clinical trials are investigating the use of Seprehvir in young patients with either CNS (NCT02031965) or non-CNS (NCT00931931) solid tumors, the latter including patients with neuroblastoma. 	In this study we evaluated a panel of 12 human neuroblastoma cell lines for their expression of HSV entry mediators and assessed their responses to Seprehvir treatment. Most cells showed high expression of nectin-1 and 3-OS HS, two HSV entry receptors that have been shown to be important determinants of HSV susceptibility in various cell types (8, 9, 16, 17) Unexpectedly, we found that HSV receptor expression did not necessarily correlate with virus entry. 
PMC5036214	NCT01119859	Methods	NCT	False	ClinicalTrials		This post-hoc study included patients from the ADACTA trial (ClinicalTrials.gov number NCT01119859). 	
PMC5123242	NCT02045004	Abstract	NCT	False	ClinicalTrials		Clinicaltrials.gov NCT02045004. 	Registered 22 January 2014. 
PMC5123242	NCT02045004	Methods	NCT	False	ClinicalTrials	The regional ethics committee (EC) approved the study prior to participant inclusion (Ethikkommission Nordwestschweiz, protocol: EKNZ 2014–155, 1 August 2014). 	The study was registered on clinicaltrials.gov (NCT02045004) on 22 January 2014 and on Kofam.ch (SNCTP000001751) on 21 April 2016. 	
PMC5154150	NCT01753050	Abstract	NCT	False	ClinicalTrials		ClinicalTrials.gov, NCT01753050 	
PMC5291642	NCT01947634	Abstract	NCT	False	ClinicalTrials	However, EDS in FD seems to be related with depression rather than SDB. 	ClinicalTrials.gov (identifier: NCT01947634). 	
PMC5291642	NCT01947634	Abstract	NCT	False	ClinicalTrials	Written informed consent was obtained from all patients included in the study. 	The study was approved by the Ethics Committee of the Canton of Zurich, Switzerland (KEK-ZH 2013–153), and is registered at ClinicalTrials.gov (identifier: NCT01947634). 	This study was conducted according to the STROBE statement. 
PMC5296269	NCT02571049	Methods	NCT	False	ClinicalTrials	The first subject was enrolled on 15 September 2015, and the study was completed on 14 April 2016. 	Additional information about this trial is available online at ClinicalTrials.gov (Identifier: NCT02571049). 	
PMC5409041	NCT03091660	Article	NCT	False	ClinicalTrials	Study Title: S1602, A Phase III Randomized Trial to Evaluate the Influence of BCG Strain Differences and T Cell Priming With Intradermal BCG Before Intravesical Therapy for BCG-Naive High-Grade Non-muscle Invasive Bladder Cancer 	Clinicaltrials.gov identifier: NCT03091660 	Sponsor: Southwest Oncology Group (SWOG) 
PMC5409041	NCT02844816	Article	NCT	False	ClinicalTrials	Study Title: S1605, Phase II Trial of Atezolizumab in BCG-Unresponsive Non-muscle Invasive Bladder Cancer 	Clinicaltrials.gov identifier: NCT02844816 	Sponsor: National Cancer Institute/Southwest Oncology Group 
PMC5509450	NCT02810418	Article	NCT	False	ClinicalTrials	As a separate approach to improve clinical responses, several groups searched for drugs that synergistically enhance immunotoxins [1, 2]. 	Paclitaxel was identified as a potent enhancer of bolus doses of mesothelin-targeted immunotoxin in vivo resulting in a new clinical trial testing the combination against solid tumors (NCT02810418) [7]. 	In line with these results, the combination of paclitaxel and CD22-targeted immunotoxin achieved a long-lasting durable remission in 60% of the mice bearing a systemic ALL xenograft and the efficacy of continuously administered immunotoxin was enhanced substantially by 100-fold in a systemic MCL mouse model [5]. These striking effects of the combination of continuously administered immunotoxin and paclitaxel strongly support future clinical trials in patients with B-cell malignancies [5]. 
PMC5574539	NCT02589353	Methods	NCT	False	ClinicalTrials	The experimental protocol was approved by the Oregon State University Institutional Review Board and complies with the Declaration of Helsinki for Medical Research. 	The experimental protocol was also registered under the Clinical Trial registry (NCT02589353), www.clinicaltrials.gov. 	
PMC5579904	NCT02550990	Abstract	NCT	False	ClinicalTrials		ClinicalTrials.gov, NCT02550990. 	Registered on 6 September 2015. 
PMC5667816	NCT02362685	Methods	NCT	False	ClinicalTrials	The Institutional Ethics Committee at Brest University Medical Center approved the study. 	Each participant, and their legal representatives if they were minor, completed a written informed consent prior to participation (Clinical Trial NCT02362685). 	
PMC5689162	NCT00788879	Abstract	NCT	False	ClinicalTrials		NCT00788879 Date: November 11, 2008. 	
PMC5695100	NCT01623557	Methods	NCT	False	ClinicalTrials		Serum samples were obtained from eighteen 18- to 50-year-old, malaria-naive, unvaccinated volunteers from three separate United Kingdom CHMI clinical trials conducted to assess the efficacy of novel vaccines: NCT01623557, NCT00890760, and NCT01142765 (also termed VAC045, MAL034B, and VAC039, respectively), all registered with ClinicalTrials.gov (71–73). 	All volunteers gave written informed consent to participate and for their samples to be stored and used for further investigations to assess immunity to malaria. The samples analyzed presently were from the six nonvaccinated volunteers who formed the infectivity control group in each of the three CHMI studies. 
PMC5695100	NCT00890760	Methods	NCT	False	ClinicalTrials		Serum samples were obtained from eighteen 18- to 50-year-old, malaria-naive, unvaccinated volunteers from three separate United Kingdom CHMI clinical trials conducted to assess the efficacy of novel vaccines: NCT01623557, NCT00890760, and NCT01142765 (also termed VAC045, MAL034B, and VAC039, respectively), all registered with ClinicalTrials.gov (71–73). 	All volunteers gave written informed consent to participate and for their samples to be stored and used for further investigations to assess immunity to malaria. The samples analyzed presently were from the six nonvaccinated volunteers who formed the infectivity control group in each of the three CHMI studies. 
PMC5695100	NCT01142765	Methods	NCT	False	ClinicalTrials		Serum samples were obtained from eighteen 18- to 50-year-old, malaria-naive, unvaccinated volunteers from three separate United Kingdom CHMI clinical trials conducted to assess the efficacy of novel vaccines: NCT01623557, NCT00890760, and NCT01142765 (also termed VAC045, MAL034B, and VAC039, respectively), all registered with ClinicalTrials.gov (71–73). 	All volunteers gave written informed consent to participate and for their samples to be stored and used for further investigations to assess immunity to malaria. The samples analyzed presently were from the six nonvaccinated volunteers who formed the infectivity control group in each of the three CHMI studies. 
PMC5698923	NCT02857153	Abstract	NCT	False	ClinicalTrials		ClinicalTrials.gov, NCT02857153. 	Registered on 15 July 2016. 
PMC5698923	NCT02857153	Methods	NCT	False	ClinicalTrials	Elderly patients will be included from seven centers, including Shenzhen People’s Hospital affiliated to Jinan University, West China Hospital affiliated to Sichuan University, The Affiliated Hospital of Guizhou Medical University, Taihe Hospital affiliated to Hubei University of Medicine, The Third Affiliated Hospital of Kunming Medical University, Sichuan Provincial People’s Hospital, and Henan Provincial People’s Hospital. 	All participants provided their written informed consent to participate in a RCT that examined the effects of low-level MAP (60–70 mmHg) vs. high-level MAP (90–100 mmHg) in elderly patients (aged 65 years or more) during non-cardiothoracic surgery under GA (trial registered at ClinicalTrials.gov under registration number: NCT02857153). 	MAP was calculated from the standard equation MAP = (2/3) diastolic blood pressure (DBP) + (1/3) systolic blood pressure (SBP) (in mmHg). We hypothesize high-level BP of the intervention for reducing the incidence of postoperative complications. 
