PMC3884852	1Z5Y	Article	PDBe	False	Background	CcmG is a membrane-anchored protein, linked to the membrane via an N-terminal TM helix and exposing its soluble TRX-like domain in the periplasm. 	The 3D structure of the TRX-like domain of CcmG from different bacteria has been solved by X-ray crystallography (E. coli: PDB 1Z5Y [85]; PDB 2B1 K [86]; B. japonicum: PDB 1KNG [87]; P. aeruginosa: PDB 3KH7, 3KH9 [22]) and is generally well conserved, as proved by the low RMSD (0.8 Å between Pa-CcmG and Ec-CcmG; 1.35 Å between Pa-CcmG and Bj-CcmG). 	Although all these proteins adopt a TRX-like fold and contain the redox-active motif CXXC in the first α-helix, they are inactive in the classic insulin reduction assay [75, 88]; CcmG proteins are therefore considered specific thiol-oxidoreductase, able to recognize and selectively interact only with their upstream and downstream binding partners in the thioreduction process leading to reduced apoCytc. Looking at the 3D structure of the periplasmic domain of the prototypical Pa-CcmG, it is possible to identify the βαβ and ββα structural motifs of the TRX fold linked by a short α-helix and forming a four-stranded β-sheet surrounded by three helices; the protein contains an additional N-terminal extension (residues 26–62) and a central insert (residues 102–123). 
PMC3884852	1KNG	Article	PDBe	False	Background	CcmG is a membrane-anchored protein, linked to the membrane via an N-terminal TM helix and exposing its soluble TRX-like domain in the periplasm. 	The 3D structure of the TRX-like domain of CcmG from different bacteria has been solved by X-ray crystallography (E. coli: PDB 1Z5Y [85]; PDB 2B1 K [86]; B. japonicum: PDB 1KNG [87]; P. aeruginosa: PDB 3KH7, 3KH9 [22]) and is generally well conserved, as proved by the low RMSD (0.8 Å between Pa-CcmG and Ec-CcmG; 1.35 Å between Pa-CcmG and Bj-CcmG). 	Although all these proteins adopt a TRX-like fold and contain the redox-active motif CXXC in the first α-helix, they are inactive in the classic insulin reduction assay [75, 88]; CcmG proteins are therefore considered specific thiol-oxidoreductase, able to recognize and selectively interact only with their upstream and downstream binding partners in the thioreduction process leading to reduced apoCytc. Looking at the 3D structure of the periplasmic domain of the prototypical Pa-CcmG, it is possible to identify the βαβ and ββα structural motifs of the TRX fold linked by a short α-helix and forming a four-stranded β-sheet surrounded by three helices; the protein contains an additional N-terminal extension (residues 26–62) and a central insert (residues 102–123). 
PMC3884852	3KH7	Article	PDBe	False	Background	CcmG is a membrane-anchored protein, linked to the membrane via an N-terminal TM helix and exposing its soluble TRX-like domain in the periplasm. 	The 3D structure of the TRX-like domain of CcmG from different bacteria has been solved by X-ray crystallography (E. coli: PDB 1Z5Y [85]; PDB 2B1 K [86]; B. japonicum: PDB 1KNG [87]; P. aeruginosa: PDB 3KH7, 3KH9 [22]) and is generally well conserved, as proved by the low RMSD (0.8 Å between Pa-CcmG and Ec-CcmG; 1.35 Å between Pa-CcmG and Bj-CcmG). 	Although all these proteins adopt a TRX-like fold and contain the redox-active motif CXXC in the first α-helix, they are inactive in the classic insulin reduction assay [75, 88]; CcmG proteins are therefore considered specific thiol-oxidoreductase, able to recognize and selectively interact only with their upstream and downstream binding partners in the thioreduction process leading to reduced apoCytc. Looking at the 3D structure of the periplasmic domain of the prototypical Pa-CcmG, it is possible to identify the βαβ and ββα structural motifs of the TRX fold linked by a short α-helix and forming a four-stranded β-sheet surrounded by three helices; the protein contains an additional N-terminal extension (residues 26–62) and a central insert (residues 102–123). 
PMC3884852	3KH9	Article	PDBe	False	Background	CcmG is a membrane-anchored protein, linked to the membrane via an N-terminal TM helix and exposing its soluble TRX-like domain in the periplasm. 	The 3D structure of the TRX-like domain of CcmG from different bacteria has been solved by X-ray crystallography (E. coli: PDB 1Z5Y [85]; PDB 2B1 K [86]; B. japonicum: PDB 1KNG [87]; P. aeruginosa: PDB 3KH7, 3KH9 [22]) and is generally well conserved, as proved by the low RMSD (0.8 Å between Pa-CcmG and Ec-CcmG; 1.35 Å between Pa-CcmG and Bj-CcmG). 	Although all these proteins adopt a TRX-like fold and contain the redox-active motif CXXC in the first α-helix, they are inactive in the classic insulin reduction assay [75, 88]; CcmG proteins are therefore considered specific thiol-oxidoreductase, able to recognize and selectively interact only with their upstream and downstream binding partners in the thioreduction process leading to reduced apoCytc. Looking at the 3D structure of the periplasmic domain of the prototypical Pa-CcmG, it is possible to identify the βαβ and ββα structural motifs of the TRX fold linked by a short α-helix and forming a four-stranded β-sheet surrounded by three helices; the protein contains an additional N-terminal extension (residues 26–62) and a central insert (residues 102–123). 
PMC3884852	2HL7	Article	PDBe	False	Background	Notably, CcmH proteins from different bacterial subgroups may display structural variability; indeed, while in E. coli Ec-CcmH is a bipartite protein characterized by two soluble domains exposed to the periplasm and two TM segments, CcmH from P. aeruginosa (Pa-CcmH) is a one-domain redox-active protein, anchored to the membrane via a single TM helix and homologous to the N-terminal redox-active domain of Ec-CcmH. 	Surprisingly, the 3D structure of the soluble periplasmic domain of Pa-CcmH revealed that it adopts a peculiar three-helix bundle fold strikingly different from that of canonical thiol-oxidoreductases (Figure 5; PDB: 2HL7; [23]). 	The N-terminal domain of Ec-CcmH was also shown to have the same 3D structure, although helix-swapping and dimerization have been observed in this case (PDB: 2KW0; [91, 92]). The conserved redox-active motif (LRCPKC) is located in the loop connecting helices 1 and 2; close to the activesite, the crystal structure reveals the presence of a small pocket on the surface of Pa-CcmH surrounded by conserved hydrophobic and polar residues, which could represent the recognition site for the heme-binding motif of apoCyt. 
PMC3884852	2KW0	Article	PDBe	False	Background	Surprisingly, the 3D structure of the soluble periplasmic domain of Pa-CcmH revealed that it adopts a peculiar three-helix bundle fold strikingly different from that of canonical thiol-oxidoreductases (Figure 5; PDB: 2HL7; [23]). 	The N-terminal domain of Ec-CcmH was also shown to have the same 3D structure, although helix-swapping and dimerization have been observed in this case (PDB: 2KW0; [91, 92]). 	The conserved redox-active motif (LRCPKC) is located in the loop connecting helices 1 and 2; close to the activesite, the crystal structure reveals the presence of a small pocket on the surface of Pa-CcmH surrounded by conserved hydrophobic and polar residues, which could represent the recognition site for the heme-binding motif of apoCyt. Concerning the functional properties of this unusual thiol-oxidoreductase, it is interesting to note that its standard redox potential (E 0′ = 0.215 V) [23] is similar to that obtained for Pa-CcmG. 
PMC3891626	608643	Abstract	OMIM	False	Background		Aromatic L-amino acid decarboxylase (AADC) deficiency (MIM #608643) is an autosomal recessive inborn error of monoamines. 	It is caused by a mutation in the DDC gene that leads to a deficiency in the AADC enzyme. The clinical features of this condition include a combination of dopamine, noradrenaline, and serotonin deficiencies, and a patient may present with hypotonia, oculogyric crises, sweating, hypersalivation, autonomic dysfunction, and progressive encephalopathy with severe developmental delay. 
PMC3891626	608643	Introduction	OMIM	False	Background		Aromatic L-amino acid decarboxylase (AADC) deficiency (Online Mendelian Inheritance in Man (OMIM® #608643) is an autosomal recessive neurotransmitter disorder.1–3 It is caused by a deficiency in AADC due to a mutation in the AADC gene (DDC) on chromosome 12p12.3-p12.3,4 This leads to deficiencies in combined monoamines, catecholamines, and serotonin. 	
PMC3892923	1CNV	Results	PDBe	False	Use	The cis confirmations of peptide bonds are mostly responsible for these deviations. 	For example, in the protein concanavalin B (PDBID:1CNV), there are four violation of the 3.8 Å constraint: Ile33/Ser34 - 4 Å, Ser34/Phe35 - 3 Å, Pro56/Ser57 - 4 Å and Trp265/Asn266 - 3.4 Å. These all these deviations are noted in the PDB file as footnotes, mentioning that ‘peptide bond deviates significantly from trans conformation’ 34. 	Another example is the Glu223-Asp24 violation in PBDid:1ADS, which is between two cis prolines (as noted in the PDB file) 35. However, these conformations are rare and not expected to occur frequently in a protein structure. 
PMC3892923	2ER7	Results	PDBe	False	Use	Figure 1b plots the root-mean-square deviation of the distance of consecutive C α (RDCC) for these ~100 proteins. 	All structures in the top100H database have low RDCC values, barring three proteins (PDBids: 2ER7, 1XSO and 4PTP), which had multiple conformations for some residues, and were excluded from the processing. 	This validates our hypothesis that RDCC is minimized in native structures. Hence, structures that have a RDCC value more than a user specified threshold can be pruned out as structures with low quality or non-native structures. 
PMC3892923	1XSO	Results	PDBe	False	Use	Figure 1b plots the root-mean-square deviation of the distance of consecutive C α (RDCC) for these ~100 proteins. 	All structures in the top100H database have low RDCC values, barring three proteins (PDBids: 2ER7, 1XSO and 4PTP), which had multiple conformations for some residues, and were excluded from the processing. 	This validates our hypothesis that RDCC is minimized in native structures. Hence, structures that have a RDCC value more than a user specified threshold can be pruned out as structures with low quality or non-native structures. 
PMC3892923	3D01	Results	PDBe	False	Use	Only five sets have RDCC values above the 0.012 Å threshold: T0492 - 0.013 Å, T0476 - 0.014 Å, T0419 - 0.025 Å, T0470 - 0.051 Å, T0423 - 0.09 Å. Some of these are the result of erroneous residue numbering in the CASP8 I-TASSER decoy set. 	For example, Ala24 is mistakenly numbered as Ala19 in T0423 (PDBid:3D01, identified by doing a BLAST search). 	Correcting this numbering results in a RDCC of 0.002 Å. Similarly, T0470 (PDBid:3DJB) has a correct RDCC of 0.001 Å, since Ser112 is mistakenly numbered as Ser101. Figure 1e plots the frequency distribution of RDCC values of protein structures based on their resolution. 
PMC3892923	3DJB	Results	PDBe	False	Use	For example, Ala24 is mistakenly numbered as Ala19 in T0423 (PDBid:3D01, identified by doing a BLAST search). 	Correcting this numbering results in a RDCC of 0.002 Å. Similarly, T0470 (PDBid:3DJB) has a correct RDCC of 0.001 Å, since Ser112 is mistakenly numbered as Ser101. 	Figure 1e plots the frequency distribution of RDCC values of protein structures based on their resolution. The RDCC values are much lower than the 0.012 Å cutoff proposed. 
PMC3892923	2JLI	Results	PDBe	False	Use	The non homologous structures (20% identity cutoff) are obtained from the PISCES database ( http://dunbrack.fccc.edu/PISCES.php). 	Certain outliers have been removed - for example, PDBid:2JLI mentions a ‘cleaved peptide bond between N263 and P264’. 	The distance between the C α atoms of N263 and P264 in this protein is 9.4 Å. Table 1 shows the mean and standard deviation for these sets, and demonstrates that the RDCC values are independent of the resolution of the structure under consideration. We have applied this cutoff on decoy sets from the Decoys 'R' Us database 28. 
PMC3892923	1FC2	Results	PDBe	False	Use	The first protein (the native structure) in all decoy sets has RDCC below the 0.012 Å cutoff ( Figure 1c). Figure 2 shows the RDCC for the hg_structral and fisa decoy sets from the Decoys 'R' Us database. 	All 500 decoy structures in each protein structure in the fisa decoy set are discriminated by applying the RDCC criterion. Figure 3 shows the superimposition of the native structure and the first decoy structure (AXPROA00-MIN) for a protein (PDBid:1FC2) taken from the fisa decoy set. 	The distance between Ile12/C α and Leu13/C α atoms is 3.8 Å and 4.1 Å in the native and the decoy structures, respectively. According to our hypothesis, a 4.1 Å distance between consecutive C α atoms is typically unfeasible in protein structures, and their occurrence should be relatively rare. 
PMC3892923	1FC2	Results	PDBe	False	Use	MolProbity 30 and ProSA 31 are two programs used as a pre-processing step for structures used in CASP 38. 	MolProbity was able to discriminate the decoy structure (AXPROA00-MIN) from the native structure (PDBid:1FC2) using a metric called the ClashScore (the number of serious steric overlaps) and the C β deviations 39. 	PROSA was unable to discriminate between the decoy and the native structures, reporting equivalent Zscores of -4.12 and -5.28, respectively. The WHATIF server report also reports steric clashes in the decoy structures ( Data File 1). 
PMC3892923	1FC2	Results	PDBe	False	Use	The first protein (the native structure) in each set has RDCC below the 0.012 Å cutoff. 	Superimposition of the native structure and a decoy structure (AXPROA00-MIN) for a protein (PDBid:1FC2) taken from the fisa decoy set. 	The native structure is in red, and the decoy structure is in green. The structures are superimposed using MUSTANG 58. 
PMC3902798	GG699410	Results	ENA	False	Use	In addition to surveying SNPs, we also searched for loss or gain of genes. 	By aligning sequence reads against the previously published NCPPB4381 genome assembly and systematically comparing gene-coverage in each of the alignments, we were able to identify a genomic region (GenBank: GG699410.1) that showed differential coverage among different isolates of Xcm (Figure 4). 	This region shows significant similarity at the amino acid and nucleotide sequence levels to two previously sequenced phage: Xanthomonas phage Cfc1 (RefSeq: NC_001396.1) [26] and Stenotrophomonas phage phiSHP2 (GenBank: HM150760.1). Specifically, two Tanzanian isolates (NCPPB4392 and NCPPB4395) appear to have completely lost at least 17 genes from this region, while Ethiopian isolate NCPPB2005 has lost 11 of the same genes. 
PMC4016241	241850	Methods	OMIM	False	Background	Goh et al. [6] have categorized the 3200 disease phenotypes in OMIM database into 22 disease groups/classes, i.e. Cancer, Metabolic, Neurological, Endocrine, etc, based on the physiological system affected. 	For example, the Endocrine disease group comprises 62 OMIM phenotypes, including OMIM 241850 (Bamforth-Lazarus syndrome) and OMIM 304800 (Diabetes insipidus, nephrogenic) etc. 	Phenotype similarity network Disease phenotype similarity network [24], is defined as GPH = (VPH, EPH), where VPH denotes the set of disease phenotypes and EPH denotes relevant phenotype pairs. 
PMC4016241	304800	Methods	OMIM	False	Background	Goh et al. [6] have categorized the 3200 disease phenotypes in OMIM database into 22 disease groups/classes, i.e. Cancer, Metabolic, Neurological, Endocrine, etc, based on the physiological system affected. 	For example, the Endocrine disease group comprises 62 OMIM phenotypes, including OMIM 241850 (Bamforth-Lazarus syndrome) and OMIM 304800 (Diabetes insipidus, nephrogenic) etc. 	Phenotype similarity network Disease phenotype similarity network [24], is defined as GPH = (VPH, EPH), where VPH denotes the set of disease phenotypes and EPH denotes relevant phenotype pairs. 
PMC4081086	1JMS	Results	PDBe	False	Use	This subdomain could be resolved in the crystal structure of TdT, but not in that of Polμ. 	Supplementary Figure S1A shows a superimposition of the conformation adopted by Loop1 of TdT in the murine apoenzyme (PDB ID: 1JMS), modelled on the ternary structure of murine Polμ with gaped DNA and incoming nucleotide (PDB ID: 2IHM, wheat). 	In agreement with its location in the core structure, Loop1 has been implicated in the terminal transferase activity of human Polμ (9) and in NHEJ of non-complementary ends assisted by accessory factors (13). To corroborate the importance of Loop1 for the bridging activity inherent to human Polμ we tested a Loop1-deletion mutant [Polμ-Δloop1; (9)] that lacks amino acids 369 to 385. 
PMC4081086	2IHM	Results	PDBe	False	Use	This subdomain could be resolved in the crystal structure of TdT, but not in that of Polμ. 	Supplementary Figure S1A shows a superimposition of the conformation adopted by Loop1 of TdT in the murine apoenzyme (PDB ID: 1JMS), modelled on the ternary structure of murine Polμ with gaped DNA and incoming nucleotide (PDB ID: 2IHM, wheat). 	In agreement with its location in the core structure, Loop1 has been implicated in the terminal transferase activity of human Polμ (9) and in NHEJ of non-complementary ends assisted by accessory factors (13). To corroborate the importance of Loop1 for the bridging activity inherent to human Polμ we tested a Loop1-deletion mutant [Polμ-Δloop1; (9)] that lacks amino acids 369 to 385. 
PMC4081086	1KDH	Results	PDBe	False	Use	Once we have shown the importance of Loop1 in NHEJ reactions performed by Polμ in the absence of accessory factors, we studied the mechanism of action of this motif by mutational analysis of candidate residues to be involved in specific interactions with the DNA substrates. 	Guided by protein multi-alignments of the four family X members (Supplementary Figure S2A) and by comparison of the available crystal structures (Figure 2A) of the murine TdT (PDB IDS: 1KDH, 1JMS) and Polμ (PDB ID: 2IHM, monomers A and B), we decided to mutate three human Polμ residues included in or near Loop1: Phe385, Arg387 and Phe389. 	
PMC4081086	1JMS	Results	PDBe	False	Use	Once we have shown the importance of Loop1 in NHEJ reactions performed by Polμ in the absence of accessory factors, we studied the mechanism of action of this motif by mutational analysis of candidate residues to be involved in specific interactions with the DNA substrates. 	Guided by protein multi-alignments of the four family X members (Supplementary Figure S2A) and by comparison of the available crystal structures (Figure 2A) of the murine TdT (PDB IDS: 1KDH, 1JMS) and Polμ (PDB ID: 2IHM, monomers A and B), we decided to mutate three human Polμ residues included in or near Loop1: Phe385, Arg387 and Phe389. 	
PMC4081086	2IHM	Results	PDBe	False	Use	Once we have shown the importance of Loop1 in NHEJ reactions performed by Polμ in the absence of accessory factors, we studied the mechanism of action of this motif by mutational analysis of candidate residues to be involved in specific interactions with the DNA substrates. 	Guided by protein multi-alignments of the four family X members (Supplementary Figure S2A) and by comparison of the available crystal structures (Figure 2A) of the murine TdT (PDB IDS: 1KDH, 1JMS) and Polμ (PDB ID: 2IHM, monomers A and B), we decided to mutate three human Polμ residues included in or near Loop1: Phe385, Arg387 and Phe389. 	
PMC4081086	1JMS	Results	PDBe	False	Use	The thumb mini-loop: flexibility of Loop1 	By analysing the available structures of TdT (PDB IDs: 1JMS, 1KEJ and 1KDH) we noticed that a second loop, located in the thumb subdomain, is establishing interactions with Loop1. 	This thumb ‘mini-loop’ contains several conserved residues responsible for these interactions, amongst them the invariant Asp473, Asn474 and His475 in murine TdT (Supplementary Figure S2B, DNH motif). This thumb mini-loop is also present in Polμ, but the sequence is not strictly conserved (Supplementary Figure S2B, NSH motif). 
PMC4081086	1KEJ	Results	PDBe	False	Use	The thumb mini-loop: flexibility of Loop1 	By analysing the available structures of TdT (PDB IDs: 1JMS, 1KEJ and 1KDH) we noticed that a second loop, located in the thumb subdomain, is establishing interactions with Loop1. 	This thumb ‘mini-loop’ contains several conserved residues responsible for these interactions, amongst them the invariant Asp473, Asn474 and His475 in murine TdT (Supplementary Figure S2B, DNH motif). This thumb mini-loop is also present in Polμ, but the sequence is not strictly conserved (Supplementary Figure S2B, NSH motif). 
PMC4081086	1KDH	Results	PDBe	False	Use	The thumb mini-loop: flexibility of Loop1 	By analysing the available structures of TdT (PDB IDs: 1JMS, 1KEJ and 1KDH) we noticed that a second loop, located in the thumb subdomain, is establishing interactions with Loop1. 	This thumb ‘mini-loop’ contains several conserved residues responsible for these interactions, amongst them the invariant Asp473, Asn474 and His475 in murine TdT (Supplementary Figure S2B, DNH motif). This thumb mini-loop is also present in Polμ, but the sequence is not strictly conserved (Supplementary Figure S2B, NSH motif). 
PMC4094489	rs361525	Methods	RefSNP	False	Use	TNF-α, IL-10 and IL-28B polymorphisms 	The −238 TNF-α polymorphism (rs361525) consists of a G to A substitution at position −238 in the proximal promoter of the TNF-α gene. 	The IL-10 polymorphism (rs1800872) consists of a C to A substitution at position −592 in the proximal promoter of the IL-10 gene. The IL-28B polymorphism (rs129679860) consists of a C to T substitution located 3 kilobases upstream of the IL28B gene. 
PMC4133382	P05181	Results	UniProt	False	Use	For example, if you use the two query protein sequences in the Example window as the input, after clicking the Submit button, you will see the following on your screen. 	(i) The 1st protein (P05181) contains 18 Y residues; of which only those located at the sequence position 71, 318, 349, 381, and 423 are of nitrotyrosine site, while all the others are of non-nitrotyrosine site. 	(ii) The 2nd protein (P03023) contains 8 Y residues; of which only those located at the sequence positions 7, 12, 17, and 47 belong to the nitrotyrosine site, while all the others belong to non-nitrotyrosine site. All these results are fully consistent with experimental observations except for one Y residue at the position 349 in the 1st protein (P05181) that is actually non-nitrotyrosine site but was overpredicted as nitrotyrosine site. 
PMC4133382	P03023	Results	UniProt	False	Use	(i) The 1st protein (P05181) contains 18 Y residues; of which only those located at the sequence position 71, 318, 349, 381, and 423 are of nitrotyrosine site, while all the others are of non-nitrotyrosine site. 	(ii) The 2nd protein (P03023) contains 8 Y residues; of which only those located at the sequence positions 7, 12, 17, and 47 belong to the nitrotyrosine site, while all the others belong to non-nitrotyrosine site. 	All these results are fully consistent with experimental observations except for one Y residue at the position 349 in the 1st protein (P05181) that is actually non-nitrotyrosine site but was overpredicted as nitrotyrosine site. 
PMC4133382	P05181	Results	UniProt	False	Use	(ii) The 2nd protein (P03023) contains 8 Y residues; of which only those located at the sequence positions 7, 12, 17, and 47 belong to the nitrotyrosine site, while all the others belong to non-nitrotyrosine site. 	All these results are fully consistent with experimental observations except for one Y residue at the position 349 in the 1st protein (P05181) that is actually non-nitrotyrosine site but was overpredicted as nitrotyrosine site. 	
PMC4146382	4BUM	Introduction	PDBe	False	Background	Thus, the 3D structure of the VDAC2 and VDAC3 isoforms have been predicted on the basis of secondary structure prediction servers [5]. 	It was only during revision of the present work that a crystallographic structure of VDAC2 was published [30] (zebra fish VDAC2; PDB code 4BUM at 2.8 Å resolution) confirming the very high degree of structural similarity with the VDAC1. 	The most striking difference between the three human isoforms is certainly the longer N-terminal fragment of hVDAC2, which has 11 residues more than the other two isoforms (figure 1). The N-terminal fragment of VDAC, comprising the first 25 amino acid residues (36 in the case of hVDAC2), is located inside the channel in the 3D structures, partially closing the wide pore [20]–[22]. 
PMC4146382	4BUM	Results	PDBe	False	Background	This resulted in their simple addition to the protein structure model according to a random coiled backbone conformation. 	Recently [30], the crystallographic structure of VDAC2 has been solved for zebra fish (PDB code 4BUM) at high resolution (2.8 Å), showing a very high degree of similarity with both the human and mouse VDAC1 3D structure. 	The root mean square deviation (rmsd) between zebra fish VDAC2 and the mVDAC reference structure used in this work is only 0.98 Å. The zebra fish VDAC2 amino acid sequence has 84% identity and 98% similarity with the human VDAC2, with the main differences located in the external loops. In agreement with the solved 3D structures, the N-terminal fragment crosses the lumen with a helical folding from the residue 6 to 20 in all the isoforms, and is horizontally located close to the lumen center. 
